noid;zona_postal;codigo_postal;limite_norte;limite_sur;limite_este;limite_oeste;tipo;barrios_contenidos_en_el_codigo_postal;veredas_contenidas_en_el_codigo_postal;codigo_municipio
2731;6820;682057;MUNICIPIO LOS SANTOS;MUNICIPIO CURITÍ;VIA CURITÍ - PIEDECUESTA;MPIO. LOS SANTOS Y JORDÁN;Rural;Sin Informacion de Barrios;El Guasino- El Potrero;68051
2732;5040;504028;MPIO. GRANADA Y RÍO ARIARI;MUNICIPIO PUERTO LLERAS;RÍO ARIARI;M. SAN J. DE ARAMA Y GRANADA;Rural;Sin Informacion de Barrios;Sin Informacion de Veredas;50287
2733;510;51051;DG 50A- 51 Y 52;CL  20C;M. COPACABANA;KR  50;Urbano;Acevedo- Acevedo Bello- Alcalá- Fontiqueño- La Camila- La Estación- La Gabriela- Las Vegas- Santa Rita- Zamora- Zona Industrial No 2- Zona Industrial No 3;Sin Informacion de Veredas;5088
2734;4180;418027;M. LA ARGENTINA Y OPORAPA;MUNICIPIO PITALITO;MUNICIPIO ELÍAS;RÍO (PERMANENTE);Rural;Sin Informacion de Barrios;ARRAYANES- EL NEME-  LA PALMA-  LAS BRISAS-  LAS PITAS-  PIRULINDA-  PROVIDENCIA-  SANTA MONICA;41660
2735;2305;230557;MUNICIPIO SAN PELAYO;CAÑO VIE. DE MARTÍNEZ- LIM. U. Y RÍO (PER.);MUNICIPIO CIENAGA DE ORO;MUNICIPIO SAN PELAYO;Rural;Sin Informacion de Barrios;Belén- Corocito-  El Coroso-  El Tapón-  Las Lauras-  Los Cañitos-  Providencia;23162
2736;5445;544578;RÍO SALAZAR;MUNICIPIO ARBOLEDAS;MUNICIPIO DURANIA;RÍO SALAZAR;Rural;Sin Informacion de Barrios;Barrientos- Chicagua Alto-  Chicagua Bajo-  Cuajadoras-  Hato Viejo-  Peña Blanca-  Potreros-  San Isidro-  San Pablo Viejo;54660
2737;7355;735587;MUNICIPIO CHAPARRAL;MUNICIPIO ATACO;MUNICIPIO CHAPARRAL;RÍO ANAMICHÉ Y (PERMANENTE);Rural;Sin Informacion de Barrios;Sin Informacion de Veredas;73616
2738;2770;277018;RÍO SUCIO;MPIO. CARMÉN DEL DARIÉN Y DABEIBA;MUNICIPIO MUTATÁ;MUNICIPIO RIOSUCIO;Rural;Sin Informacion de Barrios;Sin Informacion de Veredas;27615
2739;2506;250647;M. CALDAS Y CHIQUINQUIRA;MUNICIPIO SUSA;M. SAN MIGUEL DE SEMA;MUNICIPIO BUENAVISTA;Rural;Sin Informacion de Barrios;APOSENTOS- CENTRO;25745
2740;2030;203027;MUNICIPIO BECERRIL;MUNICIPIO CHIRIGUANÁ;PAÍS VENEZUELA;MPIO. EL PASO Y CHIRIGUANÁ;Rural;Sin Informacion de Barrios;Sin Informacion de Veredas;20400
2741;1315;131567;MPIO. CALAMAR Y MAHATES;MPIO. CALAMAR Y MAHATES;MUNICIPIO CALAMAR;MUNICIPIO MAHATES;Rural;Sin Informacion de Barrios;Sin Informacion de Veredas;13062
2742;2518;251860;CL 10;CL 2;KR 0;LIMITE URBANO;Urbano;Sin Informacion de Barrios;Sin Informacion de Veredas;25339
2743;7610;761040;LIMITE URBANO;LIMITE URBANO;LIMITE URBANO;LIMITE URBANO;Urbano;Sin Informacion de Barrios;Sin Informacion de Veredas;76890
2744;6610;661002;LIMITE URBANO;AC DEL RIO;KR  16;LIMITE URBANO;Urbano;Bosques de La Acuarela- Bosques de La Acuarela Etapa I Lote I- Bosques de La Acuarela Etapa I Lote II- Bosques de La Acuarela Etapa II- Bosques de La Acuarela Etapa III- Bosques de La Acuarela Etapa IV- Buenos Aires- Bulevar Norte- Campestre- Campestre A-;Sin Informacion de Veredas;66170
2745;4700;470007;MAR CARIBE;VIA STA. MARTA - RIOHACHA;RÍO PIEDRAS;LIMITE URBANO;Rural;Sin Informacion de Barrios;Sin Informacion de Veredas;47001
2746;5480;548037;MPIO. CÚCUTA Y PAÍS VENEZUELA;MUNICIPIO CÚCUTA;PAÍS VENEZUELA;MUNICIPIO CÚCUTA;Rural;Sin Informacion de Barrios;Sin Informacion de Veredas;54553
2747;1905;190537;VÍA TUNJA-USENDA  POR EL NORTE;MUNICIPIO CAJIBÍO;MUNICIPIO SILVIA;VÍA TUNJA-PIENDAMO Y LIM. URB.;Rural;Sin Informacion de Barrios;Sin Informacion de Veredas;19548
2748;500;50005;CL  94-  95A  Y  96A;CL 78- 80 Y 83B;LIMITE URBANO;KR  45 Y 45A;Urbano;Campo Valdés No.2- La Salle- Las Granjas- María Cano-Carambolas- Oriente- San José La Cima No.1- San José La Cima No.2- Santa Inés;Sin Informacion de Veredas;5001
2749;1940;194060;LIMITE URBANO;LIMITE URBANO;LIMITE URBANO;LIMITE URBANO;Urbano;Sin Informacion de Barrios;Sin Informacion de Veredas;19785
2750;1945;194557;MPIO. PALESTINA Y ACEVEDO;RÍO (PERMANENTE);M. SAN JOSE DE FRAGUA;MUNICIPIO SANTA ROSA;Rural;Sin Informacion de Barrios;PARQUE NATURAL NACIONAL LA CUEVA DE LOS GUACHAROS;19533
2751;520;52010;LIMITE URBANO;LIMITE URBANO;LIMITE URBANO;KR 12;Urbano;Sin Informacion de Barrios;Nevado- Zapatillo;5854
2752;2050;205057;MPIO. RÍO DE ORO Y OCAÑA;MUNICIPIO SAN ALBERTO;MPIO. OCAÑA Y ABREGO;VÍA SAN ALBERTO-AGUACHICA;Rural;Sin Informacion de Barrios;Sin Informacion de Veredas;20770
2753;2780;278017;PAÍS PANAMÁ Y MAR CARIBE;RÍO PERDIDO Y PAÍS PANAMÁ;MAR CARIBE;PAÍS PANAMÁ;Rural;Sin Informacion de Barrios;Sin Informacion de Veredas;27006
2754;2526;252660;CL 31;LIMITE URBANO;KR 6;KR 11A;Urbano;Sin Informacion de Barrios;Sin Informacion de Veredas;25878
2755;7300;730017;VIA IBAGUE - CAJAMARCA;MUNICIPIO ROVIRA;RIO COELLO;MUNICIPIO CAJAMARCA;Rural;Sin Informacion de Barrios;Altamira- Cerrajosa-  Coello Cocora-  Curalito-  Dantas-  Dantas las Pavas-  El Aguila-  El Oso-  El Paraiso-  Gamboa-  Honduras-  La Cima-  La Desputa-  La Esmeralda-  La Islandia-  La Linda-  La Loma de Cocona-  La Osera-  La Plata-Montebello-  Las Horm;73001
2756;2700;270001;LIMITE URBANO;CL  30  Y  31;LIMITE URBANO;RIO ATRATO;Urbano;Sin Informacion de Barrios;Sin Informacion de Veredas;27001
2757;5470;547059;QUEBRADA TRINIDAD;MPIO. GONZALEZ Y OCAÑA;MUNICIPIO TEORAMA;MUNICIPIO EL CARMEN;Rural;Sin Informacion de Barrios;Sin Informacion de Veredas;54206
2758;2340;234037;MUNICIPIO MONTELIBANO;VÍA LA RICA-JUAN JOSÉ;VÍA LA RICA-PTO. LIBER. Y RÍO SAN PEDRO;MUNICIPIO MONTELIBANO;Rural;Sin Informacion de Barrios;Córdoba- Francia Elena-  Villa Carmiña;23580
2759;5275;527587;OCEANO PACIFICO;MPIO. OLAYA HERRERA;MPIO. OLAYA HERRERA;ESTERO (CANAL ) SALANGO;Rural;Sin Informacion de Barrios;Sin Informacion de Veredas;52473
2760;1110;111071;AC 66A-  AK 72  Y  AC 63;AC  26;AK  72-  AC 63  Y  AK 68;TV 93-  AC 63  Y  AK 96;Urbano;El Encanto- El Real- Jardín Botánico- Los Álamos- Normandía- Normandía Occidental- San Ignacio- Santa Cecilia- Villa Luz;Sin Informacion de Veredas;11001
2761;1905;190580;LIMITE URBANO;LIMITE URBANO;LIMITE URBANO;LIMITE URBANO;Urbano;Sin Informacion de Barrios;La Toma;19780
2762;1910;191001;LIMITE URBANO;LIMITE URBANO;LIMITE URBANO;LIMITE URBANO;Urbano;Sin Informacion de Barrios;Sin Informacion de Veredas;19110
2763;5285;528528;MUNICIPIO ROBERTO PAYAN;MUNICIPIO BARBACOAS;MUNICIPIO  BARBACOAS;RELIEVE MONTAÑOSO;Rural;Sin Informacion de Barrios;Sin Informacion de Veredas;52835
2764;1925;192548;M. TOTORÓ Y VÍA INZÁ-TOTORÓ;M. PURACÉ Y LA PLATA;RÍO (PERMANENTE);MUNICIPIO TOTORÓ;Rural;Sin Informacion de Barrios;Belencito- Cordoba-  El Carmen-  EL ROSAL-  San Martin-  San Pedro-  San Vicente-  Santa Teresa;19355
2765;7330;733007;MUNICIPIO IBAGUÉ;VÍA GUAMO-SAN LUIS-SAN ANASTASIO;MPIO. GUAMO Y COELLO;M. V. DE SAN JUAN Y ROVIRA;Rural;Sin Informacion de Barrios;Cañada Unión- Cerro Gordo-  Cerro Gordo Los Pendones-  Jagua Bartolito-  Jagua Flor-  La Arenosa-  Pringamosal Guacamaya-  San Francis Centro;73678
2766;6825;682529;MUNICIPIO SAN JOAQUÍN;RÍO SUSA Y (PERMANENTE);RÍO ONZAGA;MUNICIPIO COROMORO;Rural;Sin Informacion de Barrios;Sin Informacion de Veredas;68502
2767;578;57860;CL 116;CL 91;KR 23;KR 7;Urbano;Sin Informacion de Barrios;Sin Informacion de Veredas;5837
2768;1300;130003;KR  17;CL  33 Y 32;MAR CARIBE;KR  17;Urbano;Cerro de La Popa- La María- La Paz- La Quinta- Lo Amador- Loma Fresca- Los Comuneros- Nariño- Pablo VI - I- Pablo VI - II- Palestina- Paraíso II- Pedro Salazar- Petare- República del Caribe- San Bernardo- San Francisco;Sin Informacion de Veredas;13001
2769;2526;252608;MPIO. CACHIPAY Y QUÍPILE;MPIO. ANAPOIMA Y EL COLEGIO;VIA CACHIP.-LA MESA-EL COLEGIO;MPIO. ANAPOIMA Y QUÍPILE;Rural;Sin Informacion de Barrios;ALTO DE FLORES- EL TIGRE-  HUNGRIA-  LA CONCHA-  LA TRINITA-  LAGUNAS-  SAN ESTEBAN-  SAN MARTIN-  Santa Ana-  SANTA BARBARA-  SANTA LUCIA-  Santa lucía;25386
2770;4160;416080;DG 8;CL 1;KR 1;LIMITE URBANO;Urbano;Sin Informacion de Barrios;Sin Informacion de Veredas;41770
2771;2325;232509;ARROYO SAN MIGUEL;MUNICIPIO PLANETA RICA;MPIO. PUEBLO NUEVO Y CGA. DE ORO;VÍA SAN CARLOS-EL CHARCO;Rural;Sin Informacion de Barrios;Sin Informacion de Veredas;23678
2772;5445;544529;MUNICIPIO ARBOLEDAS;MUNICIPIO SURATÁ;RÍO CUCUTILLA Y ZULIA;MUNICIPIO ARBOLEDAS;Rural;Sin Informacion de Barrios;Cinera- Despensa-  Guzman-  Helechal Alto-  Huerta Chiquita-  Juan Bueno-  Rinconada-  Rudeta-  Siravita;54223
2773;1335;133508;M. BARRANCO DE LOBA;MUNICIPIO TIQUISIO;VIA ALTOS DEL ROSARIO-EL SIDAI;MUNICIPIO PINILLOS;Rural;Sin Informacion de Barrios;Sin Informacion de Veredas;13030
2774;7635;763507;MPIO. GUA. DE BUGA;MUNICIPIO EL CERRITO;M. GINEBRA Y VÍA GUABITAS-SONSO;MUNICIPIO YOTOCO;Rural;Sin Informacion de Barrios;Sin Informacion de Veredas;76318
2775;1552;155209;RÍO MAGDALENA;CAÑO CULEBRA;MUNICIPIO BOLIVAR;RÍO MAGDALENA;Rural;Sin Informacion de Barrios;Las Quinchas- Velásquez;15572
2776;500;50026;CL 32- 31- 31A Y 31D;CL  3C- 4G  Y  LIMITE URBANO;KR 81- 80  Y DG  79;LIMITE URBANO;Urbano;Altavista- Area de Expansión Altavista- La Gloria- La Loma de Los Bernal- La Palma- Las Violetas- Los Alpes;Altavista Sector Central- Área de Expansión Altavista-  Área de Expansión Belén Rincón-  La Esperanza-  San Pablo;5001
2777;530;53027;MUNICIPIO AMALFI;VÍA YOLOMBO YALI;M. YALI Y VEGACHI;MUNICIPIO GOMEZ PLATA;Rural;Sin Informacion de Barrios;Alto de Mendez- Alto del Potrero-  Barbascal-  Bareño-  Barro Blanco-  Buenos Aires-  Cabecera Municipal-  Cachumbal-  El Comino-  El Hormiguero-  El Oso-  El Porvenir-  El Retiro-  Guayabito-  La Abisinia-  La Cabaña-  La Comba-  La Cordillera-  La Cruz-;5890
2778;578;57841;L .U- C 119- K 100-C 94-K 95 Y C 103;LIMITE URBANO;LIMITE URBANO;KR  116 Y LIMITE URBANO;Urbano;Sin Informacion de Barrios;Sin Informacion de Veredas;5045
2779;1111;111171;AC GUAYMARAL - CL 235;AC  COTA;COL. COLOMBO AMERICANO;RIO BOGOTÁ  Y  M. COTA;Urbano;Barajas Norte- Conejera- La Candelaria- La Lomita- Nuestra Señora del Rosario;Sin Informacion de Veredas;11001
2780;538;53827;MUNICIPIO SANTO DOMINGO;M. SAN RAFAEL Y GUATAPE;MUNICIPIO SAN ROQUE;MUNICIPIO CONCEPCION;Rural;Sin Informacion de Barrios;Boqueron- Cabecera Municipal-  Cruces-  El Carbón-  El Cerro-  El Jague-  El Popo-  El Respaldo-  El Rosario-  El Topacio-  Fátima-  Gamas-  La Ceiba-  La Inmaculada-  La Luz-  La Pava-  La Trinidad-  Las Mercedes-  Los Medios-  Los Naranjos-  Piedras-  P;5021
2781;6820;682018;VÍA MALAGA - CONCEPCIÓN;MPIO. SAN JOSE DE MIRANDA;MPIO. CONCEPCIÓN Y ENCISO;LIM. URB. Y M. SAN JOSE DE MIRAN.;Rural;Sin Informacion de Barrios;Sin Informacion de Veredas;68432
2782;1546;154670;LIMITE URBANO;LIMITE URBANO;LIMITE URBANO;LIMITE URBANO;Urbano;Sin Informacion de Barrios;Sin Informacion de Veredas;15106
2783;2540;254037;MUNICIPIO PAIME;MUNICIPIO PACHO;MPIO. PAIME Y SAN CAYETANO;M. TOPAIPÍ Y PACHO;Rural;Sin Informacion de Barrios;ARGENTINA- BUENOS AIRES-  CAIPAL-  CAIPAL-  EL FICAL-  EL RETIRO-  LA PERRERA-  MATA DE RAMO-  POTOSI-  SAN JERONIMO-  SAN JOSE-  SAN JOSE DE LA GAJIA-  SANTA INES-  SANTA ROSA-  SERRESUELA;25871
2784;1108;110861;AC  VILLAVICENCIO;RIO TUNJUELITO;RIO TUNJUELITO;AK  86 Y  KR 82B;Urbano;Casa Blanca Sur- Casablanca- Catalina- Catalina II- Class- El Carmelo- El Rubí- Gran Britalia- Gran Britalia I- Jacqueline- Jorge Uribe Botero- La Cecilia- Pastrana- Roma- Tocarema;Sin Informacion de Veredas;11001
2785;2522;252237;MUNICIPIO VIOTÁ;MUNICIPIO FUSAGASUGA;MUNICIPIO SILVANIA;MUNICIPIO ICONONZO;Rural;Sin Informacion de Barrios;BALUNDA- BATAVIA-  BATEAS-  CALANDAIMA-  CAPOTES-  CARACOLI-  EL CAIRO-  EL MANGO-  EL TRIUNFO-  LA PUERTA-  LA VUELTA-  NARANJAL-  SAN ANTONIO-  SAN LUIS DE CHISQUE-  SAN VICENTE-  SANTA MARIA-  SIBERIA;25805
2786;830;83001;KR 1B Y M. B/QUILLA;KR  24;AC  BOYACA;CL 43 Y 37;Urbano;Los Laureles- Urbanización El Parque- Urbanización La Arboleda- Urbanización Las Gaviotas- Urbanización Las Gaviotas II y Balkanes- Urbanización Las Trinitarias- Urbanización Parque Muvdi I- Urbanización Parque Muvdi II- Villa Cecilia- Villa del Carmen;Sin Informacion de Veredas;8758
2787;7335;733501;CL 7;LIMITE URBANO;LIMITE URBANO;KR 4;Urbano;Sin Informacion de Barrios;Sin Informacion de Veredas;73200
2788;548;54840;LIMITE URBANO;LIMITE URBANO;LIMITE URBANO;LIMITE URBANO;Urbano;Sin Informacion de Barrios;El Llano- Quiebra de San Juan;5483
2789;2524;252437;MUNICIPIO NARIÑO;MUNICIPIO  FLANDES;M. RICAURTE Y TOCAIMA;MUNICIPIO COELLO;Rural;Sin Informacion de Barrios;ACAPULCO- AGUA BLANCA-  BUSCAVIDAS-  Cabecera Municipal-  El Topacio-  GUABINAL CERRO-  LA PRADERA-  LA REFORMA-  MORRO AZUL-  ORIENTE-  POTRERILLO-  SAN LORENZO-  SANTA HELENA;25307
2790;6835;683511;CL 7;CL 0;KR 1;LIMITE URBANO;Urbano;Sin Informacion de Barrios;Sin Informacion de Veredas;68549
2791;4720;472001;CL 18;CL 1 S;KR 24 E;KR 14;Urbano;1 de Mayo- Boston- Camellón- Cataquita- Ciudadela Macondo- De Ayacucho- El Carmen- El Centro- El Parque- El Porvenir- El Pradito- El Suiche- Galán- La Esperanza- Las Delicias- Las Delicias I- Loma Fresca- Macondo- Marujita- Nariño- Palmera- Raíces- San Jo;La Polvorita;47053
2792;1530;153060;KR 8;LIMITE URBANO;LIMITE URBANO;LIMITE URBANO;Urbano;Sin Informacion de Barrios;Sin Informacion de Veredas;15778
2793;6860;686041;LIMITE URBANO;LIMITE URBANO;LIMITE URBANO;LIMITE URBANO;Urbano;Sin Informacion de Barrios;Sin Informacion de Veredas;68190
2794;6870;687067;RÍO (PERMANENTE);MUNICIPIO BARRANCABERMEJA;M. SABA. DE  TO. Y  RÍO (PERMANEN.);M. SAN PA.- CANTAGA. Y YONDO;Rural;Sin Informacion de Barrios;Cerrito- La Rinconada;68575
2795;1950;195068;Q/DA. DE MORALES Y RÍO (PERMANENTE);M. LA UNIÓN- SAN LOREN. Y TAMINANGO;Q/DA. LAS PALMAS;MUNICIPIO EL ROSARIO;Rural;Sin Informacion de Barrios;Campamento- La Esperanza;19450
2796;5440;544077;MPIO. CUCUTILLA Y PAMPLONA;MUNICIPIO SILOS;MPIO. PAMPLONA Y CÁCOTA;MPIO. VETAS Y SILOS;Rural;Sin Informacion de Barrios;Chilaguala- Chinchipa-  San Agustín-  Santa Ana;54480
2797;1760;176027;MPIO. PALESTINA Y MANIZALES;MPIO. SANTA ROSA DE CABAL;MUNICIPIO VILLAMARIA;RÍO (PERMANENTE);Rural;Sin Informacion de Barrios;Sin Informacion de Veredas;17174
2798;5250;525007;MUNICIPIO MALLAMA;Q/DA. TARFUE Y RÍO BLANCO;MUNICIPIO GUACHUCAL;RÍO (PERMANENTE);Rural;Sin Informacion de Barrios;Sin Informacion de Veredas;52227
2799;5210;521028;MPIO. SAN PABLO Y BOLIVAR;RÍO (PERMANENTE);MUNICIPIO SANTA ROSA;RÍO (PERMANENTE);Rural;Sin Informacion de Barrios;Bellavista- Dantas-  El Mesón-  El Tablón;52378
2800;528;52827;MUNICIPIO SEGOVIA;M. YOLOMBO Y PTO. BERRIO;M. YONDO Y SAN PABLO;RÍO BAGRESITO;Rural;Sin Informacion de Barrios;Ite- La  Congoja-  San Francisco;5604
2801;1810;181038;RÍO AZUL Y Q/DA. LA PROFUNDA;MUNICIPIO LA MONTAÑITA;RÍO PENEYA- VÍA EL PAU.-EL DON. Y M. EL DON.;MUNICIPIO LA MONTAÑITA;Rural;Sin Informacion de Barrios;Sin Informacion de Veredas;18256
2802;4410;441017;MAR CARIBE;MUNICIPIO MAICAO;ARROYO YUNA- CATAHIRIAI Y BOLOMBOLO;VÍA ALBANIA-SURTARÚ-ESTA. BALLENAS;Rural;Sin Informacion de Barrios;Sin Informacion de Veredas;44560
2803;1106;110611;AU  SUR;KR  25;CL  47A  Y  AC 50;RIO TUNJUELITO;Urbano;El Carmen- Escuela General Santander- Fátima- Isla del Sol- Muzú- Nuevo Muzú- Samore- San Vicente Ferrer- Venecia- Venecia Occidental;Sin Informacion de Veredas;11001
2804;1920;192047;M. SANTANDER DE QUILICHAO;RÍO OEJAS- PIOYÁ Y VÍA CALDO.-PIOYÁ;MUNICIPIO JAMBALÓ;RÍO OVEJAS;Rural;Sin Informacion de Barrios;Sin Informacion de Veredas;19137
2805;6640;664028;MPIO. BAGADÓ Y ANDES;MPIO. PUEBLO RICO Y RÍO SAN JUAN;RÍO SAN JUAN BRAVO;MUNICIPIO BAGADÓ;Rural;Sin Informacion de Barrios;Arenales- Marruecos-  Mentuara-  Paparido-  Santa Rita-  Simillito-  Sinaí;66456
2806;8510;851037;MPIO. LA SALINA Y TAME;MUNICIPIO TÁMARA;QUEBRADA AGUABLANCA;MPIO. CHITA Y LA SALINA;Rural;Zona 5;Monte Olivo;85315
2807;6860;686057;VIA PTO. BERRIO-PTO.ARAUJO;MUNICIPIO BOLIVAR;RÍO SAN JUAN;MUNICIPIO PUERTO BERRIO;Rural;Sin Informacion de Barrios;Sin Informacion de Veredas;68190
2808;7635;763532;CL 74  Y  LIM URB;CL  31 Y  32;LIMITE URBANO;KR  28;Urbano;Bizerta- Campestre- Danubio- El Bosque- El Jardín- José A Galán- La Libertad- La Orlidia- Los Cristales- Monteclaro- Obrero- Palmeras- Palmeras de Oriente- Popular Modelo- Prados de Oriente- Primero de Mayo- Providencia- San Carlos- San Cayetano- San Jorg;Sin Informacion de Veredas;76520
2809;1524;152420;CL 13;LIMITE URBANO;KR 1;KR 13;Urbano;Sin Informacion de Barrios;Sin Informacion de Veredas;15047
2810;1514;151401;KR 10;KR 1;CL 1;CL 7;Urbano;Sin Informacion de Barrios;Sin Informacion de Veredas;15180
2811;840;84080;LIMITE URBANO;LIMITE URBANO;LIMITE URBANO;LIMITE URBANO;Urbano;Sin Informacion de Barrios;Sin Informacion de Veredas;8675
2812;9520;952008;MUNICIPIO EL RETORNO;RÍO VAUPÉS;MUNICIPIO CARURU;RÍO (PERMANENTE);Rural;Sin Informacion de Barrios;Caño Arco- Caño Arenas-  Caño Guaracu-  Caño Guarumo-  Caño Leon-  Caño Yavilla Centro-  Guarapera-  La Esperanza-  La Hacienda-  Lagos del Dorado-  Milagrosa-  Miraflores-  Pueblo Nuevo-  Puerto Nare-  Vuelta del Alivio-  Yarumal;95200
2813;1526;152660;CL 11;LIMITE URBANO;KR 2;KR 15A;Urbano;Sin Informacion de Barrios;Sin Informacion de Veredas;15455
2814;6865;686507;MUNICIPIO GIRÓN;MUNICIPIO ZAPATOCA;MPIO. ZAPATOCA Y GIRÓN;RÍO CHUCURI Y M. ZAPATOCA;Rural;Sin Informacion de Barrios;Sin Informacion de Veredas;68092
2815;7635;763579;VÍA CALI - FLORIDA;MUNICIPIO PUERTO TEJADA;VÍA CANDELARIA-EL TIPLE;MUNICIPIO CALI;Rural;Sin Informacion de Barrios;Sin Informacion de Veredas;76130
2816;5200;520017;VIA PASTO - SANTIAGO;RIO CHAPAL;VIA MOTILON - EL ENCANO;LIMITE URBANO;Rural;Sin Informacion de Barrios;Sin Informacion de Veredas;52001
2817;2512;251260;LIMITE URBANO;CL 1;LIMITE URBANO;LIMITE URBANO;Urbano;Sin Informacion de Barrios;SANTA MARIA;25839
2818;1720;172028;MPIO. ABEJORRAL Y SONSÓN;MUNICIPIO PACORA;Q/DA. CHORRERA Y MPIO. SONSÓN;RÍO (PERMANENTE);Rural;Sin Informacion de Barrios;Brisas-Caunzal- Caunzal los Medios-  El Brasil-  El Llano Cañaveral-  La Giralda-  La Loma-  Los Medios-  Purina-  Rio Arma;17013
2819;7605;760508;MUNICIPIO VIJES;VIA YUMBO - LA CUMBRE;MUNICIPIO PALMIRA;MUNICIPIO LA CUMBRE;Rural;Sin Informacion de Barrios;El Chocho- Manga Vieja-  Miravalle Norte-  Mulaló-  Paso de La Torre-  Platanares-  Telecom;76892
2820;2020;202050;LIMITE URBANO;LIMITE URBANO;LIMITE URBANO;LIMITE URBANO;Urbano;15 de Noviembre- Aida Quintero- Alfonso Ávila- Atanasio Girardot- Buenos Aires- Camilo Torres- El Bosque- El Carmen- El Centro- El Estadio- El Líbano- El Millón- El Policarpa Salavarrieta- El Socorro- El Tesoro- Fátima- Hernán Gómez- José A Galán- Juguete;Sin Informacion de Veredas;20013
2821;7615;761557;MPIO. EL DOVIO Y LA UNIÓN;VIA EL DOVIO - ZARZAL;MPIO. LA VICTORIA Y ZARZAL;MUNICIPIO EL DOVIO;Rural;Sin Informacion de Barrios;Cañada Honda- El Guasimo-  El Lucero-  La Despensa-  La Isla-  Las Palmas-  Lindero-  Matecaña-  Samana-  San Pedro;76622
2822;1910;191078;VÍA EL TETILLO-EL CRUCERO;VÍA S. DE QUILICHAO-NATALA;MPIO. CORINTO Y TORIBÍO;MPIO. S. DE QUILICHAO;Rural;Sin Informacion de Barrios;Alto de Palo- Alto Pilamo-  Bodega-  Bodega Alta-  Cabecera Municipal-  Crucero de Guali-  Damian-  El Credo-  El Nilo-  El Pedregal-  El Porvenir-  El Venadillo-  Guabito-  Guasimo-  La Arboleda-  La Despensa-  La Quebrada-  La Selva-  La Trampa-  López;19142
2823;5440;544010;CL 6A;CL 1 SUR;KR 1;KR 4;Urbano;Blanco- Calle Real- El Calvario- El Centro- La Esperanza- La Paz;Sin Informacion de Veredas;54125
2824;1325;132507;MUNICIPIO ZAMBRANO;MUNICIPIO SAN PEDRO;VIA ZAMBRANO-SAN PEDRO;M. OVEJAS Y EL CARMEN DE BOL.;Rural;Sin Informacion de Barrios;Barro Prieto;13212
2825;2540;254047;MUNICIPIO MUZO;MUNICIPIO VILLAGOMEZ;MUNICIPIO SAN CAYETANO;MPIO. YACOPÍ Y TOPAIPÍ;Rural;Sin Informacion de Barrios;ATUCHA- BECUIPIA-  BUCAMA-  CAMINOS-  CAPICHA-  CAPIRA-  COMBUCO-  CORRUCHA-  CUBACHE-  DE CERRO AZUL-  EL CARMEN-  EL PALMAR-  EL PLOMO-  GINEBRA-  GUAGUANCU-  GUAQUIMAY-  IRLANDIA-  JAMAICA-  LA AGUITA-  LA CARRERA-  LA PIEDRA-  LA UNION-  LAGUNA DE COR;25518
2826;7060;706057;MAR CARIBE;MPIO. PALMITO Y PURISIMA;MPIO. SANTIAGO DE TOLU;MUNICIPIO SAN ANTERO;Rural;Sin Informacion de Barrios;Cerro petrona- Porvenir;70221
2827;550;55028;RÍO PIEDRAS;MUNICIPIO ABEJORRAL;M. EL CARMEN DE VIBORAL;MUNICIPIO LA CEJA;Rural;Sin Informacion de Barrios;Chalarca- Guarango-  La Cabaña-  Las Brisas-  Las Piedras-  Mazorcal-  San Francisco;5400
2828;2518;251827;MUNICIPIO UBAQUE;MUNICIPIO FOSCA;M. FÓMEQUE Y QUETAME;MPIO. UNE Y CHIPAQUE;Rural;Sin Informacion de Barrios;Alto de Cruz- Banco-  El Carmen-  El Páramo-  El Tablon-  El Volador-  Ganco-  Giron de Blancos-  Giron de Moyas-  Giron de Resguardo-  Hoya de Santiago-  Hoyas-  La Chapa-  La Jabonera-  Los Pinos-  NOVILLEROS-  Palo Grande-  Ponta-  PONTA-  POTRERO ALTO;25151
2829;548;54810;CL 12;LIMITE URBANO;CL 10A;CL 6;Urbano;Sin Informacion de Barrios;Asiento Grande- Guacales-  La Maravilla;5652
2830;1910;191049;M. JAMUNDÍ Y VILLA RICA;VÍA S. DE QUILICHAO-PALOMERA;MUNICIPIO CALOTO;VÍA S. DE QUILICHAO-VILLAPAZ;Rural;Sin Informacion de Barrios;El Alba Paraíso- La Palomera-  Marañón;19698
2831;5280;528068;MUNICIPIO MAGÜI;RPIO TELEMBI;RÍO SAMBIAMBI Y RÍO (PERMANENTE);MPIO. ROBERTO PAYAN;Rural;Sin Informacion de Barrios;Sin Informacion de Veredas;52079
2832;578;57869;MAR CARIBE;M. BELEN DE BAJAIRA;MUNICIPIO APARTADO;M. RÍO SUCIO Y UNGIA;Rural;Sin Informacion de Barrios;Palmichal;5837
2833;1800;180007;M. GARZON Y M. GUADALUPE;RIO HACHA;RIO BRAVO Y M. LA MONTAÑITA;RIO HACHA Y VIA NEIVA - FLOR.;Rural;Entre Ríos- Urbanización Nisola;El Líbano;18001
2834;560;56067;M. BETANI Y HISPANIA;RÍO PERMANENTE;MUNICIPIO JERICO;MUNICIPIO BAGADO;Rural;Las Mercedes;Area sin Levantar- Buenos Aires-  Cabecera Municipal-  Cajones-  Cristiania-  El Troya-  La Aguada-  La Florida-  La Irene-  La Italia-  La Linda-  La Pica-  La Puria-  La Raya-  La Rochela-  Las Animas-  Morro Amarillo-  Mulatico-  Río Frío-  San Bartolo;5034
2835;1905;190550;LIMITE URBANO;LIMITE URBANO;LIMITE URBANO;LIMITE URBANO;Urbano;Sin Informacion de Barrios;Cabecera Municipal- La Estación-  La Floresta-  Matarredonda-  Santa Rosa;19473
2836;1340;134067;MUNICIPIO GUARANDÁ;RÍO CAUCA;MUNICIPIO MONTECRISTO;CAÑO MUÑOZ;Rural;Sin Informacion de Barrios;Ciritongo- La Escondida-  La Mula-  Puerto España-  San Antonio-  Taburetera-  Tangal;13655
2837;1710;171007;MPIO. ARANZAZU Y SALAMINA;MUNICIPIO MANIZALES;MUNICIPIO MARULANDA;VÍA MANIZALES-NEIRA-FILADELFIA;Rural;Sin Informacion de Barrios;Las Peñas- Morro Azul-  Pandeazucar-  Santa Isabel;17486
2838;1840;184018;MPIO. CARTA. DEL CHAIRÁ Y RÍO YARÍ;M. LEGUI.- P. ALEGRI- LA CHO. Y P. S/DER.;RÍO YARÍ;RÍO CAQUETÁ;Rural;Sin Informacion de Barrios;Sin Informacion de Veredas;18756
2839;1522;152287;M. STA ROSA DEV Y FLORESTA;MUNICIPIO SOGAMOSO;RÍO (PERMANETE);MUNICIPIO TIBASOSA;Rural;Sin Informacion de Barrios;Bonza- Cabecera Municipal-  Dicho-  El Salitre-  Galeras-  Guáquira-  La Manga-  San Martín-  Siatame-  Suescun-  Suescun-  Ucuengá;15491
2840;558;55820;LIMITE URBANO;LIMITE URBANO;LIMITE URBANO;LIMITE URBANO;Urbano;Sin Informacion de Barrios;Sin Informacion de Veredas;5347
2841;550;55078;MPIO. TARSO;M. JERICO Y LA PINTADA;L. U.- M. STA BARB. Y RELIEVE M.;M. TARSO Y JERICO;Rural;Sin Informacion de Barrios;Aguacatal- Buenos Aires-  Cabecera Municipal-  Cadenas-  Chamuscados-  Combia Chiquita-  Combia Grande-  El Calvario-  El Cerro-  El Cinco-  El Limón-  El Molino-  El Porvenir-  El Raicero-  El Rincon-  El Zancudo-  Hoyo Frío-  La Arabia-  La Cordillera-;5282
2842;7030;703017;MPIO. GALERAS Y EL ROBLE;CAÑO MISALO Y RÍO (PERMANENTE);MPIO. SUCRE Y MAGANGUÉ;MPIO. CHINU Y CAIMITO;Rural;Sin Informacion de Barrios;El Roble;70678
2843;1910;191008;MUNICIPIO JAMUNDÍ;VÍA SAN ANTONIO-B. AIRES Y RÍO CAUCA;MPIO. SANTANDER DE QUILICHAO;RÍO MARILOPEZ;Rural;Sin Informacion de Barrios;Sin Informacion de Veredas;19110
2844;570;57058;M. CAICEDO- Q/DA. PESCADO Y PUNA;MPIO. ANZÁ Y EBEJICO;MUNICIPIO SOPETRÁN;MUNICIPIO CAICEDO;Rural;Sin Informacion de Barrios;El Chorrillo- El Jaque-  El Plan-  Guaimaral-  Guasimal-  La Tolda-  Obregon-  Sabanas;5042
2845;7300;730008;VIA IBAGUE - ALVARADO;MUNICIPIO SAN LUIS;MUNICIPIOS PIEDRAS Y COELLO;VIA IBAGUE - ROVIRA;Rural;Sin Informacion de Barrios;Altos de Comucima- Altos de Gualanday-  Aparco-  Briceño-  Buenos Aires-  Cabecera Municipal-  Cañadas Potrerito-  Carmen de Dulira-  Cural Comucima-  El Golupo-  El Hobo-  El Morro-  El Rodeo-  El Salitre-  El Totumo-  La Cueva-  La Laguna-  LLano de Com;73001
2846;4780;478040;LIMITE URBANO;LIMITE URBANO;LIMITE URBANO;KR 1;Urbano;Aquí te espero- La Unión- Los Alpes- Nuevo Oriente- Penjamo- Providencia- San José- San Martín;Sin Informacion de Veredas;47570
2847;1524;152407;MUNICIPIO AQUITANIA;MUNICIPIO AGUAZUL;MUNICIPIO LABRANZAGRANDE;MUNICIPIO RECETOR;Rural;Sin Informacion de Barrios;Cabecera Municipal- Charanga-  Curisi-  Huerta Vieja-  Jotas-  Miraflores-  Quebrada Negra-  Sabana;15518
2848;2740;274019;MPIO. MEDIO SAN JUAN;MPIO. EL LITORAL DEL SAN JUAN;MUNICIPIO SIPÍ;RÍO SAN JUAN;Rural;Sin Informacion de Barrios;Sin Informacion de Veredas;27361
2849;6815;681537;MUNICIPIO SAN MIGUEL;MPIO. SAN MATEO Y BOAVITA;RÍO (PERMANENTE);MUNICIPIO CAPITANEJO;Rural;Sin Informacion de Barrios;Buraga- Cabecera Municipal-  Concordia-  El Juncal-  Floresta-  Ilarguta-  La Palma-  Macaravita Huerta-  Monterredondo-  Pajarito-  Ropejo-  San Jacinto;68425
2850;8120;812019;MUNICIPIO ARAUCA;M. HATO COROZAL;CAÑO LAS ESCUDILLAS;MUNICIPIO PUERTO RONDON;Rural;Sin Informacion de Barrios;Agualinda- Buenos Aires-  Camoruco-  Comarca-  Corralito-  Cumare-  El Corozo-  El Matal de Flor Amirillo-  La Reforma-  Las Caballos-  Los Laureles-  Matal de Flor Amarillo-  Onaruco-  Santa Bárbara-  Villa Nueva;81220
2851;5275;527569;OCEANO PACIFICO;Q. GRANDE- RÍO SANQUI. Y E. MAN.;MUNICIPIO LA TOLA;MUNICIPIO MOSQUERA;Rural;Sin Informacion de Barrios;Sin Informacion de Veredas;52490
