noid;zona_postal;codigo_postal;limite_norte;limite_sur;limite_este;limite_oeste;tipo;barrios_contenidos_en_el_codigo_postal;veredas_contenidas_en_el_codigo_postal;codigo_municipio
1897;2530;253007;M. ZIPACÓN Y FACATATIVA;MUNICIPIO SOACHA;M. MOSQUERA Y MADRID;M. LA MESA- TENA Y SAN ANT. DEL T.;Rural;Sin Informacion de Barrios;EL CORZO;25099
1898;830;83005;KR 14 Y 17;DG  56 Y CL 37;CL  30;AC  MURILLO;Urbano;Ciudadela Metropolitana- El Oasis- La Bonanza- La Fé- Los Cusules- Manuela Beltrán- Soledad 2000- Urbanización Terranova II- Villa Adela- Villa Karla- Zarabanda;Sin Informacion de Veredas;8758
1899;4430;443047;MUNICIPIO HATONUEVO;ARROYO POZO HONDO;VÍA BARRANCAS-HATONUEVO;ARROYO POTRE. DE VENANCIO Y SECO;Rural;Sin Informacion de Barrios;Sin Informacion de Veredas;44078
1900;2310;231047;MPIO. SAN BERNARDO DEL VIENTO;VÍA SAN ANTERITO-COTOCA ARRIBA;ARROYO PORVENIR Y SAN MATEO;MUNICIPIO MOÑITOS;Rural;Sin Informacion de Barrios;Sin Informacion de Veredas;23417
1901;1300;130017;MAR CARIBE;M. SAN ONOFRE;MUNICIPIO TURBANA;MAR CARIBE;Rural;Sin Informacion de Barrios;Sin Informacion de Veredas;13001
1902;7020;702077;MUNICIPIO SAN PEDRO;MUNICIPIO GALERAS;MUNICIPIO BUENAVISTA;AY. MANCOMOJÁN Y RÍO (PERMANENTE);Rural;Sin Informacion de Barrios;Sin Informacion de Veredas;70742
1903;1950;195001;LIMITE URBANO;LIMITE URBANO;LIMITE URBANO;LIMITE URBANO;Urbano;Sin Informacion de Barrios;Sin Informacion de Veredas;19100
1904;2770;277017;MUNICIPIO RIOSUCIO Y TURBO;RÍO SUCIO;MPIO. TURBO Y MUTATÁ;MUNICIPIO RIOSUCIO;Rural;Sin Informacion de Barrios;Belén de Bajira- Los Cedros-  Nueva Esperanza-  Villa del Carmen-  Villa Luz;27615
1905;9120;912019;M. PTO SANTANDER Y MIRITÍ;PERÚ;MUNICIPIO LA PEDRERA;QUEBRADA CARIJONA;Rural;Sin Informacion de Barrios;Sin Informacion de Veredas;91536
1906;6865;686539;CAÑO ARENOSO;MPIO. EL CARMEN DE CHUCURI;RÍO OPONCITO;MUNICIPIO SIMACOTA;Rural;Sin Informacion de Barrios;LA TEMPESTUOSA- LLAMA CALIENTE;68689
1907;1506;150687;M. SATIVANORTE Y SATIVASUR;M. TASCO Y BETEITIVA;MUNICIPIO SATIVASUR;M. TUTAZA Y BELEN;Rural;Sin Informacion de Barrios;Bura- Chitagoto-  Chorrera-  La Chapa-  Mobacon-  Piedra Gorda-  Salitre-  Sibaria-  Sibaria-  Ticuaquita-  Tobachia-  Tunjos;15537
1908;1840;184019;M. LA MONTAÑITA- MILÁN Y VALPARAISO;MUNICIPIO LEGUIZAMO;M. C/GENA DEL CHAIRA Y RÍO CAQUETÁ;M. PTO. GUZMÁN Y LEGUIZAMO;Rural;Sin Informacion de Barrios;Sin Informacion de Veredas;18756
1909;7620;762001;LIMITE URBANO;LIMITE URBANO;LIMITE URBANO;LIMITE URBANO;Urbano;Sin Informacion de Barrios;Sin Informacion de Veredas;76243
1910;1350;135028;M. SANTA ROSA DEL SUR;MUNICIPIO SAN PABLO;CAÑO BARBÚ Y Q/DA. INANEA;M. SANTA ROSA DEL SUR;Rural;Sin Informacion de Barrios;Bosque Bajo- Cuadro-  Diego López-  El Diamante-  El Paraíso-  El Popal-  El Triángulo-  Humadera Alta-  Humadera Media-  La Carolina-  La Cascada-  La Maya-  Las Ánimas-  Las Palmeras-  Las Trampas-  Monterrey-  Nimas Altas-  Rabo Largo-  Sabana Baja-  S;13744
1911;1110;111021;RIO JUAN A.-  CL 99  Y  93;AC  80;AK  68;AK  96;Urbano;Autopista Medellín- Bochica- Ciudad Bachué- Ciudad Bachué I Etapa- El Minuto de Dios- La Serena- Los Cerezos- Luis Carlos Galán- París Gaitán- Primavera- Quirigua- Quirigua Oriental;Sin Informacion de Veredas;11001
1912;5460;546057;MUNICIPIO ABREGO;RÍO (PERMANENTE);MUNICIPIO CÁCHIRA;MUNICIPIO SAN ALBERTO;Rural;Sin Informacion de Barrios;La Palma- Monterrey-  Puerto Carreño;54385
1913;578;57878;MAR CARIBE;MUNICIPIO TURBO;RÍO MULATOS;MAR CARIBE;Rural;Sin Informacion de Barrios;Sin Informacion de Veredas;5490
1914;2524;252401;LIMITE URBANO;LIMITE URBANO;CL 1;CL 11;Urbano;Sin Informacion de Barrios;Sin Informacion de Veredas;25488
1915;1925;192518;Q/DA. BARBACO. Y VÍA LA CEJA-VILLA RO.;MPIO. LA PLATA Y PAICOL;MUNICIPIO NATAGA;MPIO. INZÁ Y LA PLATA;Rural;Sin Informacion de Barrios;Alto del Carmen- Aránzazu-  BAJO PATICO-  Bello Horizonte-  CANSARROCINES-  El Hato-  El Mirador-  EL SOCORRO-  EL TRIUNFO-  Esmeralda-  GETZEN-  Juntas Birmania-  LA CASCAJOSA-  La Honda-  LA LINDOSA-  LADERAS-  laderas-  LAS MERCEDES-  LUCITANIA-  Pasta;19517
1916;6860;686021;LIMITE URBANO;LIMITE URBANO;LIMITE URBANO;LIMITE URBANO;Urbano;Sin Informacion de Barrios;Sin Informacion de Veredas;68385
1917;2305;230537;MUNICIPIO LORICA;MPIO. CERETÉ Y MONTERIA;VÍA CUERO CURTIDO-REMOLINO;MUNICIPIO PUERTO ESCONDIDO;Rural;Sin Informacion de Barrios;Aguas Blancas- Bálsamo-  Buenos Aires-  El Jobal-  La Esperanza-  La Iguana-  La Victoria-  Las Manuelitas-  Las Margaritas-  Pajonal-  San Miguel-  Santa Clara-  Si Te Gusta;23686
1918;840;84087;MUNICIPIO MANATI;MUNICPIO SUAN;MUNICIPIO CAMPO DE LA CRUZ;MUNICIPIO CALAMAR;Rural;Sin Informacion de Barrios;Sin Informacion de Veredas;8675
1919;1540;154047;MUNICIPIO CHIQUIZA;MPIO. CUCAITA Y TUNJA;MUNICIPIO MOTAVITA;MPIO. SACHICA Y SAMACA;Rural;Sin Informacion de Barrios;Cabecera Municipal;15762
1920;5020;502049;RÍO GUARROJO;CAÑO MARRA Y RUBIALES;MUNICIPIO CUMARIBO;VÍA LAS CULATAS-LOS KIOSCOS;Rural;Sin Informacion de Barrios;Sin Informacion de Veredas;50568
1921;2500;250057;M. BOJACA Y MOSQUERA;MUNICIPIO SIBATE;LIMITE URBANO;M. S. A. DEL TEQ. Y GRANADA;Rural;Sin Informacion de Barrios;BALSILLAS;25754
1922;1508;150840;LIMITE URBANO;LIMITE URBANO;LIMITE URBANO;LIMITE URBANO;Urbano;Sin Informacion de Barrios;Sin Informacion de Veredas;15368
1923;7630;763008;MUNICIPIO SEVILLA;M. TULUÁ Y ANDALUCÍA;MUNICIPIO TULUÁ;VÍA ANDALUCÍA-PAILA ARRIBA;Rural;Sin Informacion de Barrios;Sin Informacion de Veredas;76113
1924;7605;760510;LIMITE URBANO;LIMITE URBANO;LIMITE URBANO;LIMITE URBANO;Urbano;Central- La Estación- La Margarita- Municipal- Pueblo Nuevo- Sector La Cancha- Sector Las Palmas- Sector Lejano Oriente- Sector Timbio- Urbanización Francisco Jaramillo- Villanueva;Sin Informacion de Veredas;76377
1925;6320;632040;LIMITE URBANO;LIMITE URBANO;LIMITE URBANO;LIMITE URBANO;Urbano;Sin Informacion de Barrios;Sin Informacion de Veredas;63111
1926;2740;274058;RÍO SIPÍ- Q/DA. SOROBIATA Y RÍO (PERMA.);MPIO. EL LITORAL DEL SAN JUAN;MUNICIPIO BOLÍVAR;MPIO. ISTMINA Y MEDIO SAN JUAN;Rural;Sin Informacion de Barrios;Sin Informacion de Veredas;27745
1927;4160;416088;VÍA SUAZA-ACEVEDO Y RÍO (PERMA.);M. BELEN DE LOS ANDA. Y FLORENCIA;Q/DA. EMAYA Y MPIO. FLORENCIA;VÍA SUAZA-ACEVEDO Y M. ACEVEDO;Rural;Sin Informacion de Barrios;ALTO HORIZONTE- ALTO TABLON-  ANAYACO-  BOLIVAR-  BRASIL-  BRAZUELITOS-  CAMPO HERMOSO-  DELICIAS-  EL AVISPERO-  EL HORIZONTE-  EL RECREO-  EL RECREO-  EL TABLON-  EL VERGEL-  FATIMA-  INDEPENDENCIA-  LA ARGENTINA-  LA ESMERALDA-  LAS DELICIAS-  LAS JUNT;41770
1928;578;57858;MUNICIPIO APARTADÓ;MUNICIPIO CHIGORODO;VIA CHIGORODÓ-APARTADÓ;MUNICIPIO TURBO;Rural;Sin Informacion de Barrios;Bocas de Chigorodo- Cabecera Municipal-  Carepita Canal-  Carepita km 4-  Carepita Pronexcol-  Chirido-  Chirido-  El Encanto-  El Vijao-  Ipankay-  La Cadena-  La Cadena-  La Candelaria-  La Unión-  Las Quinientas-  Las Trecientas-  Nueva Esperanza-  Zun;5147
1929;6835;683537;M. SOCORRO Y PAL. DEL SOCORRO;M. OIBA Y CHARALA;MUNICIPIO PARAMO;MUNICIPIO GUAPOTÁ;Rural;Sin Informacion de Barrios;Agua Buena- Aguabuena-  Aguabuena-  Corinto-  Hoya San José-  La Lajita-  Palmar-  Palmarito-  Palmarito-  Verdín;68209
1930;6840;684028;VÍA ARATOCA-VILLANUEVA-BARICHARA;MUNICIPIO SAN GIL;MUNICIPIO CURITI;MUNICIPIO BARICHARA;Rural;Sin Informacion de Barrios;Sin Informacion de Veredas;68872
1931;9430;943057;RÍO INÍRIDA;CAÑO MICO Y MPIO. PANA PANA;MUNICIPIO INÍRIDA;RÍO INÍRIDA Y CAÑO MICO;Rural;Sin Informacion de Barrios;Sin Informacion de Veredas;94888
1932;5420;542058;RÍO MARGUA;MUNICIPIO CHITAGÁ;MUNICIPIO TOLEDO;MUNICIPIO CHITAGÁ;Rural;Sin Informacion de Barrios;Aguas Caliente- Aposentos-  Canchica-  Cascaro-  Jove-  La Carbonera-  La Chona-  La Compañia-  La Vega-  Paramito-  Pedro Alonso-  Providencia El limoncito-  Sopota-  Tierra Grata-  Valegra-  Venaga;54377
1933;8800;880028;MAR CARIBE;LIMITE URB. (STA. CATALINA) Y MAR CARIBE;MAR CARIBE;MAR CARIBE;Rural;Sin Informacion de Barrios;Sin Informacion de Veredas;88564
1934;5030;503068;MPIO. PUERTO LLERAS;MPIO. SAN J. DEL GUAVIARE;RÍO ARIARI Y CAFRE;MUNICIPIO VISTAHERMOSA;Rural;Sin Informacion de Barrios;Caño Tigre- La Carpa-  La Rompida-  Villa la Paz;50590
1935;5470;547078;RÍO BOKDROM BOKI;QUEBRADA TRINIDAD;MUNICIPIO CONVENCIÓN;M. CHIMICHA.- PAILITAS- PELAYA Y LA GLORIA;Rural;Sin Informacion de Barrios;Casa de Piedra- La Luna Sector 2;54245
1936;554;55411;CL  12 S;CL  63;KR  42;TV 52D Y KR 52D;Urbano;La Esmeralda- San Fernando- Santa María No 2- Santa María No 3- Simón Bolívar;Sin Informacion de Veredas;5360
1937;4100;410006;CL 1 S Y AV CIRCUN;LIMITE URBANO;KR  41;M. PALERMO;Urbano;Altos Del Limonar I- Altos Del Limonar II- Andalucía II Etapa- Arismendi Mora Perdomo- Bella Vista- Bogotá- Buenos Aires- Canaima- Conjunto Los Arrayanes- Emaya- Jesús Nazareno- José Antonio Galán- La Esperanza- Las Lajas- Limonar II Etapa- Loma Linda- Lo;Sin Informacion de Veredas;41001
1938;5020;502041;LIMITE URBANO;LIMITE URBANO;LIMITE URBANO;LIMITE URBANO;Urbano;Centro- El Triunfo- Esperanza- José A. Galán- Manacacias- Popular- Villa Ortíz;Sin Informacion de Veredas;50568
1939;4140;414047;MUNICIPIO PAICOL;MUNICIPIO ALTAMIRA;MPIO. GIGANTE Y GARZÓN;MUNICIPIO PITAL;Rural;Sin Informacion de Barrios;Alto Buena Vista- ARRAYON-  El Astillero-  El Carmen-  EL DIAMANTE-  EL OCASO-  EL VERGEL-  GALDA-  LA CUMBRE-  MATAMBO-  Montecitos-  Sabaneta;41013
1940;2040;204040;KR 17;LIMITE URBANO;CL 18;CL 1;Urbano;Sin Informacion de Barrios;Sin Informacion de Veredas;20550
1941;5265;526527;RÍO (PERMANENTE);MUNICIPIO LINARES;MUNICIPIO LINARES;MUNICIPIO LA LLANADA;Rural;Sin Informacion de Barrios;El Maco- Humero-  La Montaña-  Parapetos-  Tablon;52418
1942;4400;440001;MAR CARIBE;CL 15;LIMITE URBANO;LIMITE URBANO;Urbano;Sin Informacion de Barrios;Sin Informacion de Veredas;44001
1943;9130;913019;RÍO Y LA CHORRERA;PERÚ;M. PUERTO ARICA;PERÚ;Rural;Sin Informacion de Barrios;Sin Informacion de Veredas;91263
1944;1506;150607;M. CERINZA Y BETEITIVA;MUNICIPIO NOBSA;MUNICIPIO BUSBANZA;M. SANRA ROSA DE VITERBO;Rural;Sin Informacion de Barrios;Cachavita- Centro-  Chámeza Menor-  Cuche-  Egipto-  El Olivo-  La Chorrera-  La Creciente-  Novare-  Otengá-  Peñitas-  Quebrada Arriba-  Santa Ana-  Siraquita;15276
1945;5225;522527;MUNICIPIO EL TAMBO;MUNICIPIO CONSACÁ;MUNICIPIO LA FLORIDA;M. LINARES Y ANCUYÁ;Rural;Sin Informacion de Barrios;Bella Vista- El Baisal-  El Rodeo-  La Tola-  Los Limos-  Robles;52683
1946;1340;134020;CL 16;CL 3;LIMITE URBANO;LIMITE URBANO;Urbano;Sin Informacion de Barrios;Sin Informacion de Veredas;13006
1947;5460;546078;VÍA OCAÑA-CÚCUTA;MPIO. LA ESPERANZA Y CACHIRA;M. VILLA CARO Y CACHIRA;RÍO OROQUE;Rural;Sin Informacion de Barrios;Brisas del Tarra- Canoas-  Casitas-  Cuestaboba-  El ?ltimo-  El Doce-  El Molino-  El Ramo-  El Rincón-  El Roble-  El Roble-  El Tarra-  El Trapichero-  Gaira-  La Estancia-  La Primavera-  Nuevo Sol-  Paramillo-  Paramito-  Páramo de Los Ranchos-  Puer;54003
1948;1940;194067;M. PATÍA Y LA SIERRA;VÍA PATÍA-LA VEGA;MUNICIPIO LA VEGA;MPIO. BOLÍVAR Y PATÍA;Rural;Sin Informacion de Barrios;Sin Informacion de Veredas;19785
1949;2540;254020;KR 0;KR 4;CL 1;CL 9;Urbano;Sin Informacion de Barrios;CENTRO;25258
1950;5010;501018;CAÑO MACAPAY Y RÍO CABUYARITO;MPIO. CUMARAL Y PTO. LÓPEZ;RÍO META;MUNICIPIO PARATEBUENO;Rural;Sin Informacion de Barrios;Cabuyarito- Delicias-  El Vergel-  MACAPAY BAJO-  PALOMAS MARARABE-  SAN LUIS DE NAGUAYA-  San Miguel;50124
1951;2780;278038;RÍO TIGRE O TICOLÉ Y (PERMANENTE);MUNICIPIO RIOSUCIO;MUNICIPIO TURBO;PAÍS PANAMÁ;Rural;San Cayetano;Sin Informacion de Veredas;27800
1952;9410;941018;CAÑO CHANGUITA;MUNICIPIO PUERTO COLOMBIA;CAÑO CHIGUIRE Y RÍO (PERMANENTE);MUNICIPIO INÍRIDA;Rural;Sin Informacion de Barrios;Sin Informacion de Veredas;94886
1953;1536;153668;M. SORA Y SAHICA;M. VENTAQUEMADA Y GUACHETA;VÍA CAITA - SAMACA - VENTAQUEMADA;MUNICIPIO RAQUIRA;Rural;Sin Informacion de Barrios;Estancia Grande- Matanegra-  Parroquia Vieja;15646
1954;4410;441059;VÍA PORCHINA-CARRIZAL;PAÍS VENEZUELA;VÍA LAGUNA DE KUISA-JEPI;AY. JASALU.- KAWALAIN.- SEPTANA E IRUAIN;Rural;Sin Informacion de Barrios;Sin Informacion de Veredas;44847
1955;5030;503027;CAÑO OVEJAS- CLARO- CUMA. Y RÍO  SIARE;M. PTO. CONCORDIA Y SAN J. DEL GUAVIARE;RÍO (PERMANENTE);MPIO. PTO. LLERAS Y PTO. RICO;Rural;Sin Informacion de Barrios;El Edén- Sabanas de La Fuca;50325
1956;8530;853017;MPIO. PORE Y PAZ DE ARIPORO;MPIO. SAN LUIS DE PALENQUE;VÍA BÉLGICA-EL PORVENIR;M. PORE Y SAN LUIS DE PALENQUE;Rural;Sin Informacion de Barrios;El Banco de La Canada;85430
1957;2320;232059;ARROYO SAN VICENTE;MPIO. SAHAGÚN Y LA UNIÓN;ARROYO SAN VICENTE;VÍA SAHAGÚN-CHINU;Rural;Sin Informacion de Barrios;Dividivi- La Floresta-  Las Llanadas-  Los Aldanas-  Rincón Grande-  Sabanas de La Fuente-  Sal Si Puedes;23182
1958;5230;523068;MUNICIPIO OSPINA;MUNICIPIO CONTADERO;RÍO (PERMANENTE);MUNICIPIO PUPIALES;Rural;Sin Informacion de Barrios;Santo Domingo- Simón Bolívar;52352
1959;1920;192009;MUNICIPIO CALOTO;MUNICIPIO JAMBALÓ;RÍO RENCE.- ISABELILLA Y (PERMA.);MUNICIPIO JAMBALÓ;Rural;Sin Informacion de Barrios;Belen- Betulia-  El Flayo-  El Tablazo-  Estadero-  Estrella-  La Laguna-  La Mina-  La Primicia-  Lodega-  Loma Linda-  Manzano-  Potrerito-  Pueblo Viejo-  San Julian-  Santa Rita-  Toribio-  Toribío_Cauca-  Vichiqui;19821
1960;1830;183010;CL 10;CL 1;KR 1;LIMITE URBANO;Urbano;Sin Informacion de Barrios;Sin Informacion de Veredas;18150
1961;5205;520538;RÍO (PERMANENTE);RÍO APONTE;MPIO. MOCOA Y SAN FCO.;MUNICIPIO BUESACO;Rural;Sin Informacion de Barrios;Campo Alegre- El Cedro-  El Porvenir-  Gavilla Baja-  La Providencia-  Los Alpes-  Pitalito Alto-  Puerto Esperanza;52258
1962;4760;476040;KR 13;KR 1;CL 8;CL 1;Urbano;Sin Informacion de Barrios;Sin Informacion de Veredas;47541
1963;2540;254008;MUNICIPIO TOPAIPÍ;MUNICIPIO SUBACHOQUE;M. VILLAG.- RÍO NEG. Y VIA ZIP.-PACH.;M. EL PEÑÓN- VERGARA Y SUPATÁ;Rural;Sin Informacion de Barrios;AGUACHENTALES- ALGODONALES-  ALTO YASAL-  ANGULA-  BAJO YASAL-  Cerinza-  CHAPA-  Corcega-  CUCHARAL-  EL CARBON-  EL COBRE-  EL ENCANTADO-  EL FLORIDO-  EL GAVILAN-  EL HATILLO-  EL PALMAR-  EL PALMAR-  EL PENCIL-  ENCANTADO-  Guacamayas-  GUANACAS-  GUA;25513
1964;1514;151448;RÍO RATONCITO Y (PERMANENTE);MPIO. EL COCUY Y TAME;RÍO RATONCITO Y MPIO. TAME;M. CHISCAS- EL ESPINO Y PANQUEBA;Rural;Sin Informacion de Barrios;Sin Informacion de Veredas;15332
1965;1915;191569;MUNICIPIO MIRANDA;MUNICIPIO TORIBÍO;MPIO. PLANADAS Y TORIBÍO;CORDILLERA CENTRAL;Rural;Sin Informacion de Barrios;Santo Domingo;19212
1966;7335;733540;LIMITE URBANO;A SALDAÑA;KR 1;LIMITE URBANO;Urbano;Sin Informacion de Barrios;Sin Informacion de Veredas;73319
1967;8530;853010;LIMITE URBANO;CL 1;KR 9A;KR 1;Urbano;Donaire- El Centro- Las Ferias- Panorama- San Jorge- Santo Domingo- Villa María - Palmeras;Bucare- El Merey-  El Palito-  Trinidad;85430
1968;1750;175037;MPIO. SONSÓN Y PTO. BOYACÁ;RÍO PONTONÁ;MPIO. PUERTO SALGAR;MPIO. NORCASIA Y VICTORIA;Rural;Sin Informacion de Barrios;Isaza- Jagual Bajo-  RIONEGRITO-  SAN CAYETANO-  San Jose-  TALAVERA;17380
1969;2504;250420;CL 6A;CL 1;KR 1E;TV 7;Urbano;Sin Informacion de Barrios;ALTO DE MESA- HATICO Y HENEAS-  LA HUERTA-  PAPYO;25154
1970;1522;152218;MUNICIPIO MONGUI;MUNICIPIO AQUITANIA;MUNICIPIO AQUITANIA;RÍO EL MORRO Y Q/DA MARTINERA;Rural;Sin Informacion de Barrios;Sin Informacion de Veredas;15759
1971;8620;862069;MPIO. PTO. CAICEDO Y PTO. GUZMÁN;MUNICIPIO LEGUIZAMO;MUNICIPIO PUERTO GUZMÁN;RÍO PINUNA BLANCO;Rural;Sin Informacion de Barrios;Alto Pinuña- Bajo Mansoya-  Canacas-  Carmen del Piñuña-  El Águila-  Jerusalén-  Las Minas-  Lisberia-  Montebello-  Peneya-  Piñuña Blanco-  Piñuña Blanco-  Puerto Bello-  San Ignacio;86568
1972;4150;415087;MUNICIPIO LA PLATA;MPIO. TARQUI Y OPORAPA;MUNICIPIO PITAL;VÍA BELÉN-OPORAPA;Rural;Sin Informacion de Barrios;AGUA BLANCA- ALTO CARMEN-  BAJO CARMEN-  BAJO PESCADOR-  BETANIA-  BETANIA-  BLANQUESINO-  EL ARRAYAN-  EL CARMEN-  EL MADROÑAL-  EL PARAISO-  LA ESPERANZA-  LA UNION-  LA UNION-  LAS MERCEDES-  LAS MINAS-  LAS MINAS-  LAS TOLDAS-  LOS ANDES-  LOS MILAGRO;41378
1973;7620;762008;MUNICIPIO NOVITA;Q/DA. YARUMO Y RÍO (PERMANENTE);MUNICIPIO LA CELIA;MPIO. SAN JOSE DEL PALMAR;Rural;Sin Informacion de Barrios;Sin Informacion de Veredas;76243
1974;1104;110431;CL 34 S Y  36 S;CL 45 S  Y  46 S;LIMITE URBANO;AK  10;Urbano;Altamira- Altos del Poblado- Altos del Zipa- Altos del Zuque- Barcelona Sur- Bellavista Sur- Bosque de Los Alpes- La Arboleda- La Gloria Occidental- La Gloria Oriental- La Victoria- Las Guacamayas- Las Lomas- Moralba- Puente Colorado- Quindío- San José Su;Sin Informacion de Veredas;11001
1975;1700;170009;RIO CHINCHINÁ;MUNICIPIO VILLA MARIA;LIMITE URBANO;MUNICIPIO PALESTINA;Rural;Sin Informacion de Barrios;Agua Bonita- Alto del Zarzo-  El Aventino-  La Pola;17001
1976;2030;203040;CL 13 B;CL 5 S;KR 14;LIMITE URBANO;Urbano;Sin Informacion de Barrios;Sin Informacion de Veredas;20178
1977;1350;135048;M. SIMITÍ Y STA. ROSA DEL SUR;MUNICIPIO CANTAGALLO;VIA SAN PABLO-POZO AZUL;MPIO. SEGOVIA Y REMEDIOS;Rural;Sin Informacion de Barrios;Sin Informacion de Veredas;13670
1978;2500;250002;LIMITE URBANO;CL 17 Y AC PRADILLA;LIMITE URBANO;LIMITE URBANO;Urbano;Sin Informacion de Barrios;Fragua;25175
1979;1935;193537;VÍA TIMBÍO-CUATRO ESQUINAS;MPIO. ROSAS Y EL TAMBO;VÍA POPAYÁN-ROSAS;MUNICIPIO EL TAMBO;Rural;Sin Informacion de Barrios;Barro Blanco- Campo Sano-  El Altillo-  El Naranjal-  El Uvo-  Santa Maria;19807
1980;9910;991049;VÍA TRES MA.-CÑ. EL TIG.-PALMA.Y CÑ. URIBA;RÍO VICHADA;RÍO VICHADA;VÍA TRES MATAS-PTO. RICO Y SENDERO;Rural;Sin Informacion de Barrios;Sin Informacion de Veredas;99773
1981;1522;152268;MPIO. DUITAMA Y STA. ROSA DE VI.;VÍA PAIPA-SOGAMOSO;MUNICIPIO NOBSA;MUNICIPIO DUITAMA;Rural;Sin Informacion de Barrios;Aguatendida- Boyera-  Boyera-  Cabecera Municipal-  Chorrito-  Chorrito-  Peña Negra-  Peña Negra-  San Lorenzo de Abajo-  Tocogua-  Vuelltas-  Vueltas;15806
1982;6810;681031;LIMITE URBANO;LIMITE URBANO;LIMITE URBANO;LIMITE URBANO;Urbano;Sin Informacion de Barrios;Guaca Centro;68318
1983;2516;251647;RÍO NEGRO;MUNICIPIO QUETAME;MUNICIPIO EL CALVARIO;M. UBAQUÉ Y CÁQUEZA;Rural;Sin Informacion de Barrios;AL PASTORA- CEREZOS-  CHINUA-  COACHA-  GUACHANOVA-  HATO VIEJOZ-  LA CHORRERA-  LA MARGARITA-  MORTICAL-  PAVAL-  QUEBRADA BLANCA-  RIO NEGRO-  SUSA-  TABLON;25279
1984;6825;682537;MPIO. MOGOTES Y CHARALA;RÍO GUACHAVITA;MPIO. ONZAGA Y RÍO (PERMANEN.);MPIO. CHARALA;Rural;Sin Informacion de Barrios;Chapa Hoya Grande- La Laguna-  San Cayetano;68217
1985;7060;706010;LIMITE URBANO;LIMITE URBANO;LIMITE URBANO;LIMITE URBANO;Urbano;Brisas del Mar- Calle Nueva- Centro- Ciudadela El Golfo- El Arroyito- El Cangrejo- El Edén- El Palmar- El Progreso- El Santuario- El Símbolo- La Esperanza- La Gracia de Dios- Luis Carlos Galán- Mafufo- Playa Hermosa- Samora- San Felipe- San Isidro- San Mi;Sin Informacion de Veredas;70820
1986;8540;854010;CL 29;CL 1;KR 11A;KR 1;Urbano;Sin Informacion de Barrios;Belgrado- Cabecera Municipal-  Las Islas-  Mata de Piña-  Mundo Nuevo;85139
1987;7350;735078;MUNICIPIO RÍOBLANCO;MUNICIPIO IQUIRA;RÍO CANDELARI.- ATÁ- SAN MI. Y Q. EL BOSQ.;M. MIRANDA- CORINTO- TORIBÍO Y PÁEZ;Rural;Sin Informacion de Barrios;Aguas Blancas- El Progreso-  La Bella-  La Palmera-  Los Guayabos-  Marquetalia-  Palomar-  Peña Rica-  Resguardo Parque-  Santa Rosa-  Villa Nueva;73555
1988;6860;686047;MPIO. PUERTO  PARRA;MUNICIPIO LANDÁZURI;M. PTO. PARRA Y LANDÁZURI;Q/DA. LA PERDIDA Y RÍO GUAYABITO;Rural;Sin Informacion de Barrios;Sin Informacion de Veredas;68190
1989;5000;500007;MUNICIPIO EL CALVARIO;RÍO OCOA;M. RESTREPO Y LIM. URB.;MUNICIPIO GUAYABETAL;Rural;Sin Informacion de Barrios;El Palmar-  San Isidro;50001
1990;1526;152640;CL 7;CL 1;A PAEZ;KR 8;Urbano;Sin Informacion de Barrios;Sin Informacion de Veredas;15135
1991;7020;702078;MUNICIPIO LOS PALMITOS;MPIO. EL ROBLE Y GALERAS;AY. MANCOMOJÁN Y RÍO (PERMANENTE);M. SAN JUAN DE B. Y COROZAL;Rural;Corintio;Sin Informacion de Veredas;70742
1992;7355;735509;VÍA ORTEGA-VILLA HERMOSA;MUNICIPIO CHAPARRAL;VÍA ORTEGA-CHAPARRAL;MUNICIPIO SAN ANTONIO;Rural;Sin Informacion de Barrios;Altozano- Boca de Per.-  Cabecera Municipal-  Calarma-  Cedrales-  Chicala-  Chontaduro-  Copial-  Corazon de Peral-  El Carmen-  El Diamante-  El Jardin-  El LLano de O-  El Maco-  El Vergel-  Guayabito-  Guayabo Alto-  Guayabo P.N.-  Guayaquil-  La Arge;73504
1993;5200;520037;RÍO PERMANENTE;MUNICIPIO TANGUA;RIO PERMANENTE;MUNICIPIO TANGUA;Rural;Sin Informacion de Barrios;La Palizada- San Luis Alto-  San Luis Bajo;52001
1994;7355;735557;MPIO. PIJAO Y CAJAMARCA;MPIO. CHAPARRAL Y SAN ANTONIO;M. ROVIRA Y SAN ANTONIO;MPIO. GENOVA Y SEVILLA;Rural;Sin Informacion de Barrios;Cabecera Municipal- Cajamarca-  El Triunfo-  Las Pavas-  Legía Alta-  Los Guayabos-  Meseta Ventilla-  Pringamosal-  Recreo Alto-  Recreo Bajo-  San Francisco-  San Jeronimo;73622
1995;9160;916057;M. SOLANO- PACOA- PTO ALEGRIA;RÍO MIRITÍ PARANÁ;M. LA PEDRERA;RÍO MIRITÍ PARANÁ;Rural;Sin Informacion de Barrios;Sin Informacion de Veredas;91460
1996;4410;441001;CL 1;CL 20;KR 15A;LIMITE URBANO;Urbano;Sin Informacion de Barrios;Sin Informacion de Veredas;44560
1997;1910;191030;CL 15;LIMITE URBANO;LIMITE URBANO;KR 21;Urbano;Sin Informacion de Barrios;Sin Informacion de Veredas;19698
1998;1315;131507;MUNICIPIO REPELÓN;MUNICIPIO MAHATES;M. SAN CRISTOBAL Y CALAMAR;MPIO. SAN ESTANISLAO;Rural;Sin Informacion de Barrios;Evitar- Mahates;13760
1999;9120;912018;M. PUERTO SANTANDER;PERÚ;RÍO YURÍ- QUEBRADA CARIJONA;RÍO PERMANENTE;Rural;Sin Informacion de Barrios;Sin Informacion de Veredas;91536
2000;6860;686027;MUNICIPIO PUERTO PARRA;RÍO GUAYABITO Y (PERMANENTE);M. VELEZ Y RÍO (PERMANENTE);MUNICIPIO CIMITARRA;Rural;Sin Informacion de Barrios;Bellavista- La Perdida-  La Verde;68385
2001;2526;252667;M. APULO Y RÍO LINDO;MPIO. NILO Y TIBACUY;M. TIBACUY Y SILVANIA;M. TOCAIMA Y APULO;Rural;Sin Informacion de Barrios;ALBANIA- ATALA-  BALCONES-  BEJUCAL-  BRASIL-  BUENAVISTA-  BUENOS AIRES-  CAROTES-  CEILA-  CHONTADURO-  EL PALMAR-  EL RECREO-  FLORENCIA-  GLORIA-  JAZMIN-  LA CAJITA-  LA ESCUELA-  LA ESPERANZA-  LA FLORIDA-  LAGUNAS-  LIBERIA-  MOGANBO-  PAJAS BLANCA;25878
2002;1720;172007;MUNICIPIO PACORA;RÍO POCITO Y CHAMBERU;RÍO (PERMANENTE);MUNICIPIO LA MERCED;Rural;Sin Informacion de Barrios;Sin Informacion de Veredas;17653
2003;2510;251067;MUNICIPIO SESQUILÉ Y MACHETÁ;MUNICIPIO GUASCA;M. GACHETÁ Y JUNÍN;M. TOCANCIPA Y GACHANCIPA;Rural;Sin Informacion de Barrios;CANAVITA- CARBONERA ALTA-  CARBONERA BAJA-  CASADILLAS ALTO-  CHALECHE-  CHALECHE-  CHOCHE-  CORALES-  EL HATO-  EL ROBLE-  EMBALSE DE TOMINE-  ESMARALDA-  GOBERNADOR-  GUANDITA-  MATILLO-  MONTECILLO-  POTRERO LARGO-  SALINAS-  SAN BARTOLOME-  SANTA BARB;25326
2004;6620;662017;MPIO. SANTUARIO Y LA CELIA;MPIO. ANSERMANUEVO Y PEREIRA;MPIO. SANTUARIO Y LA VIRGINIA;MPIO. LA CELIA Y EL AGUILA;Rural;Sin Informacion de Barrios;Cabecera Municipal- Calabazas-  Carminales Alto-  Carminales Bajo-  Cocohondo-  Corinto-  Cristales-  Cruces-  El Cedral-  El Chuscal-  El Manzano-  El Tambo-  El Vergel-  Granatal-  Guaimaral-  La Alejandría-  La Cancha Alta-  La Cascada-  La Ciénaga-  L;66075
2005;500;50020;CL  49;KR 31- 28- CL  19A Y 19;KR  11C  Y  CL  44C;KR 30- 32 Y  CL 31A;Urbano;Bomboná No.2- Cataluña- La Milagrosa- Loreto- Los Cerros El Vergel- Miraflores;Sin Informacion de Veredas;5001
2006;6805;680561;KR 1;KR 7;LIMITE URBANO;CL 10;Urbano;Sin Informacion de Barrios;Sin Informacion de Veredas;68444
2007;7305;730527;Q/DA. LA CAIMA Y M. VENADILLO;MUNICIPIO PIEDRAS;MUNICIPIO PIEDRAS;MUNICIPIO IBAGUÉ;Rural;Sin Informacion de Barrios;La Chumba;73026
2008;5200;520008;MUNICIPIO CHACHAGUI Y BUESACO;LIMITE URBANO;RIO PERMANENTE;VIA PASTO - CHACHAGUI;Rural;Sin Informacion de Barrios;Palmas Alto- Tebaida;52001
2009;7620;762007;Q/DA. YARUMO Y RÍO (PERMANENTE);MUNICIPIO ANSERMANUEVO;MPIO. LA CELIA Y BALBOA;MPIO. SAN JOSE DEL PALMAR;Rural;Sin Informacion de Barrios;La Pedrera;76243
2010;6840;684007;VÍA PIEDE.-PARQ. NAL. CHI.-ZAPA.;MPIO. ARATOCA Y JORDÁN;MUNICIPIO PIEDECUESTA;Q/DA. LOS SANTOS Y RÍO (PERMA.);Rural;Sin Informacion de Barrios;La Esperanza - El Duende- Los Cacaos;68418
2011;7320;732047;MUNICIPIO LA DORADA;LIMITE URBANO;MUNICIPIO GUADUAS;MUNICIPIO MARIQUITA;Rural;Sin Informacion de Barrios;San Antonio;73349
2012;1905;190548;RÍO (PERMANENTE);MUNICIPIO CAJIBÍO;VÍA MORALES-CAJIBÍO;MUNICIPIO CAJIBÍO;Rural;Sin Informacion de Barrios;Sin Informacion de Veredas;19548
2013;5455;545518;QUEBRADA COLORADA;MPIO. SAN CAYETANO Y SANTIAGO;MUNICIPIO CÚCUTA;MPIO. SARDINATA Y GRAMALOTE;Rural;Sin Informacion de Barrios;Sin Informacion de Veredas;54261
2014;1107;110731;RIO TUNJUELITO;DG 73F S  Y  KR 80I;AK  80;AK 77G  Y  M. SOACHA;Urbano;Antonia Santos- Argelia II- Bosa- El Jardín- Gran Colombiano- Islandia- Jiménez de Quesada- Los Laureles- Paso Ancho- San Bernardino I- San Diego Bosa;Sin Informacion de Veredas;11001
2015;6320;632007;MUNICIPIO SALENTO;MPIO. CAICEDONIA- PIJAO Y BUENAVISTA;MPIO. CORDOBA Y RÍO SANTO DOMINGO;MPIO. ARMENIA Y LA TEBAIDA;Rural;Ladrilleras- Los Tanques;Chaguala- El Castillo;63130
2016;5265;526529;MUNICIPIO BARBACOAS;MUNICIPIO LA LLANADA;M. CUMBITARA Y RÍO (PERMANENTE);MUNICIPIO LA LLANADA;Rural;Sin Informacion de Barrios;Buena Vista- El Campanario-  El Caucho-  El Palmar-  Guadualito-  La Floresta-  Santa Helena;52418
2017;820;82067;M JUAN DE ACOSTA;MUNICIPIO SABANALARGA;MUNICIPIO BARANOA;MUNICIPIO PIOJO;Rural;Sin Informacion de Barrios;Sin Informacion de Veredas;8849
