noid;zona_postal;codigo_postal;limite_norte;limite_sur;limite_este;limite_oeste;tipo;barrios_contenidos_en_el_codigo_postal;veredas_contenidas_en_el_codigo_postal;codigo_municipio
1055;6810;681048;MUNICIPIO SANTA BARBARA;MPIO. SAN ANDRES Y CEPITÁ;VÍA SAN ANDRES-SANTA BARBARA;MUNICIPIO PIEDECUESTA;Rural;Sin Informacion de Barrios;Piedra Abajo- Río Negro;68318
1056;7000;700009;LIMITE URBANO;MUNICIPIO SAN PUES;MUNICIPIO COROZAL;ARROYO MOCHÁ;Rural;Sin Informacion de Barrios;Canta Gallo- Don Alonso;70001
1057;2506;250608;VIA CUCUN.-LENGUAZ.-TURMEQUE;MUNICIPIO CHOCONTÁ;MUNICIPIO VILLAPINZÓN;MUNICIPIO CUCUNUBÁ;Rural;Sin Informacion de Barrios;BUITA- CHIRVANEQUE-  EL RHUR-  EL TABLON-  ESPINAL ALISAL-  ESPINAL CARRIZAL-  FARACIA-PANTANITOS-  FARACIA-RETAMO-  FIANTOQUE-  GUANGUITA-  HATO DE ROJAS-  HATO FIERO-  HATOGRANDE-  JUAITOQUE-  LA CUBA-  LA RAMADA-  Nemoconcito-  RAMADA ALTA-  RAMADA FLO;25407
1058;7030;703030;CL 23;CL 8 SUR;KR 8;KR 1 SUR;Urbano;Sin Informacion de Barrios;Sin Informacion de Veredas;70771
1059;1111;111156;AC  170;CL  138;AU NORTE;KR  92;Urbano;Altos de Suba- Atenas- Britalia- Cantagallo- Casa Blanca Suba I- Casablanca Suba- Delmonte- El Plan- Escuela de Carabineros- Gilmar- Granada Norte- Iragua- Mazuren- Portales del Norte- Prado Pinzón- San José V Sector- Santa Helena- Suba Cerros- Suba Urban;Sin Informacion de Veredas;11001
1060;6815;681547;M. ENCISO Y SAN JOSE DE MIRANDA;RÍO (PERMANENTE);MUNICIPIO SAN MIGUEL;MUNICIPIO COVARACHIA;Rural;Sin Informacion de Barrios;Agua Sucia- Moralito-  Siotes-  Tapias;68147
1061;4750;475038;M. CHIBOLO Y SABANAS DE SAN ANGEL;M. STA. BÁRBA. DE PINTO Y SANTA ANA;MPIO. NUEVA GRANADA;VÍA CHIBOLO-STA. BÁRBARA DE PINTO;Rural;Sin Informacion de Barrios;Consuelo- Santa Ines;47555
1062;2528;252830;LIMITE URBANO;CL 1;CL 17;LIMITE URBANO;Urbano;Sin Informacion de Barrios;Sin Informacion de Veredas;25483
1063;5450;545037;MUNICIPIO EL ZULIA;MPIO. DURANIA Y SALAZAR;M. EL ZULIA Y SAN CAYETANO;MPIO. GRAMALOTE Y SALAZAR;Rural;Sin Informacion de Barrios;Alto de Frio- Cuperena-  El Pijon-  La Amarilla;54680
1064;5245;524520;LIMITE URBANO;LIMITE URBANO;LIMITE URBANO;LIMITE URBANO;Urbano;Sin Informacion de Barrios;Calputan- Egido San Antonio-  El Espino Sur-  La Concordia-  San Juan Chiquito-  Tres Esquina;52585
1065;1920;192077;VÍA SILVIA-CALDONO;VÍA SILVIA-PIENDAMÓ;VÍA SILVIA.CALDONO;MUNICIPIO PIENDAMÓ;Rural;Sin Informacion de Barrios;Sin Informacion de Veredas;19743
1066;1502;150247;M. OICATA Y TUTA;MUNICIPIO SIACHOQUE;MUNICIPIO TOCA;MUNICIPIO OICATA;Rural;Sin Informacion de Barrios;Agua Blanca- Agua Blanca-  Chaine-  Leonera-  Leonera-  Pirgua-  Puente Hamaca-  San Francisco-  Tuaneca;15187
1067;5235;523507;MUNICIPIO CONSACÁ;RÍO (PERMANENTE);MUNICIPIO PASTO;MUNICIPIO YACUANQUER;Rural;Sin Informacion de Barrios;Birmania- Chavez-  El Paramo-  El Tambor-  La Aguada-  La Pradera-  Los Ajos-  Marqueza Bajo-  Mejía;52788
1068;9430;943067;MPIO. MAPIRIPANA Y BARRANCO MINAS;CAÑO MOSQUITO Y RÍO INÍRIDA;MPIO. INÍRIDA Y RÍO INÍRIDA;MUNICIPIO MAPIRIPANA;Rural;Sin Informacion de Barrios;Sin Informacion de Veredas;94888
1069;8550;855038;CAÑO AGUA CLARA Y DE UPÍA;VÍA CARIBA.-LOS GEMELOS Y RÍO (PERMA.);MUNICIPIO TAURAMENA;M. CABUYARO Y BARRANCA DE UPÍA;Rural;Sin Informacion de Barrios;Caiman Bajo- Flor Amarillo-  La Camanga Leche Miel;85440
1070;7600;760016;DG  24;KR  28A  Y  28D;TV 103 Y CL 105;TV 103   Y  CL 105;Urbano;Alfonzo Bonilla Aragon- José Manuel Marroquín I- José Manuel Marroquín II- Los Naranjos;Sin Informacion de Veredas;76001
1071;7640;764007;MUNICIPIO CALI;RÍO CLARO;M. PTO. TEJADA Y VILLA RICA;MPIO. BUENAVENTURA;Rural;Alfaguara- Covicedros- El Rosario- Los Mandarinos;CHALO- JUAN IGNACIO;76364
1072;2532;253257;MUNICIPIO CHAGUANÍ;MUNICIPIO PULÍ;MUNICIPIO VIANI Y QUIPILE;M. BELTRÁN Y RÍO SECO DE LAS PALMAS;Rural;Sin Informacion de Barrios;CENTRO- EL CARMEN-  GUAYAQUIL-  HATO-  IVANCITO-  MESITA-  PARAMON-  SAN NICOLAS;25662
1073;1516;151647;M. PAZ DE RÍO Y SATIVASUR;MUNICIPIO TASCO;MUNICIPIO SOCOTÁ;MPIO. PAZ DE RÍO Y TASCO;Rural;Sin Informacion de Barrios;Sin Informacion de Veredas;15757
1074;1945;194558;RÍO (PERMANENTE);MUNICIPIO PUERTO GUZMÁN;M. CURILLO Y SAN J. DE FRAGUA;MUNICIPIO MOCOA;Rural;Sin Informacion de Barrios;Sin Informacion de Veredas;19533
1075;1945;194508;MUNICIPIO LA VEGA;MPIO. STA. ROSA Y RÍO (PERMANENTE);RÍO (PERMANENTE);MUNICIPIO ALMAGUER;Rural;Sin Informacion de Barrios;Altos de Las Palmas- Barbillas-  Cajibio-  Chopiloma-  Monterredondo-  Nueva Providencia-  Rionegro;19693
1076;6805;680567;RÍO SANTA CRUZ;MUNICIPIO CHARTA;MUNICIPIO SURATÁ;M. RIONEGRO Y B/MANGA;Rural;Sin Informacion de Barrios;Abejas- Caña-  Capilla Parte Baja-  El Aburrido-  El Puerto-  La Aguada-  La Playa-  Lavadores-  Magueyes-  Ovejera-  Pericos-  Pirka-  Rinconada-  San Pedro Alto;68444
1077;6815;681557;MPIO. ENCISO Y CARCASI;MPIO. MACARAVITA;M. CARCASI Y MACARAVITA;MPIO. CAPITANEJO;Rural;Sin Informacion de Barrios;Puertas- Quebrada Honda-  Saucara;68686
1078;1950;195060;CL 2N;CL 18;KR 5;KR 6;Urbano;Sin Informacion de Barrios;Sin Informacion de Veredas;19450
1079;510;51070;CL 28;LIMITE URBANO;KR 9;LIMITE URBANO;Urbano;Sin Informacion de Barrios;Sin Informacion de Veredas;5656
1080;4170;417060;LIMITE URBANO;LIMITE URBANO;LIMITE URBANO;LIMITE URBANO;Urbano;Sin Informacion de Barrios;Sin Informacion de Veredas;41530
1081;8160;816018;CAÑO TOTUMO- RÍO LIPA;RÍO CUSAY- CAÑO AGUA AZUL;MUNICIPIO ARAUCA;MUNICIPIO FORTUL;Rural;Sin Informacion de Barrios;Alto Primore- Arauquita_Arauca-  Brisas de Caranal-  Cuatro de julio-  El Carmen-  El Cusay-  El Futuro-  El Paraiso-  Filipinas-  Gaviota del Caranal-  La Comunidad-  La Comunidad-  La Gloria-  La Reserva-  LA Victoria-  Los Almendros-  Los Colonos-  Los;81065
1082;2720;272040;LIMITE URBANO;LIMITE URBANO;LIMITE URBANO;LIMITE URBANO;Urbano;Avenida Jiménez- Bahía Solano- Caracas- Divino Niño- Jiménez- Las Brisas- Miraflores- Pueblo Nuevo- San Antonio- Serpa Uribe- Villa del Prado- Vírgen del Carmen;Sin Informacion de Veredas;27135
1083;2030;203020;LIMITE URBANO;LIMITE URBANO;KR 3 E;KR 12;Urbano;17 de Febrero- 20 de Noviembre- 5 de Marzo- El Centro- El Paraíso- El Progreso- La Florida- La Y- Las Malvinas- Los Comuneros- Luis Carlos Galán- Ovelio Jiménez- San José- Santander- Simón Bolívar- Toscano;Sin Informacion de Veredas;20400
1084;5070;507058;MPIO. GUTIÉRREZ Y BOGOTÁ D. C.;MUNICIPIO CUBARRAL;MPIO. ACACÍAS Y RÍO GRANDE;MUNICIPIO CUBARRAL;Rural;Sin Informacion de Barrios;Sin Informacion de Veredas;50318
1085;6865;686508;MUNICIPIO GIRÓN;MUNICIPIO ZAPATOCA;RÍO CHUCURI;MUNICIPIO SAN VICENTE DE CHUCURI;Rural;Sin Informacion de Barrios;Belmonte- LLAMA FRIA-  Mata de Cacao-  Sogamoso-  VISCAINAS;68092
1086;6330;633001;CL 10;LIMITE URBANO;LIMITE URBANO;LIMITE URBANO;Urbano;Alfonso Lopez- Balastretar- Barrios Unidos- Buena Vista- Buenos Aires- Cacique- Caicedonia- Caldas- Centenario- Centro- Chica- Cincuentenario- Ciudad Alegría- Colón- Compartir- Comuneros- Corrales- El Carmen- Esmeralda- Gaitán- Goretti- La Avanzada- La Gr;Sin Informacion de Veredas;63470
1087;6835;683578;MUNICIPIO GALÁN;MUNICIPIO SIMACOTA;MPIO. GALÁN Y PALMAR;MPIO. EL CARMEN DE CHUCURÍ;Rural;Sin Informacion de Barrios;Altacruz- La Montuosa-  Santa Ana de Flores;68344
1088;7600;760010;KR  7;AK SUR ORIENTAL;CL  44;CL  26 Y 25;Urbano;Atanasio Giraldo- Benjamín Herrera- El Troncal- Industrial- La Floresta- Las Américas- Municipal- Parque de La Caña- Primitivo Crespo- Rafael Uribe Uribe- Saavedra Galindo- Santa Mónica Polpular- Santafé- Simón Bolívar;Sin Informacion de Veredas;76001
1089;1111;111176;RIO BOGOTÁ  Y  M. CHIA;AC GUAYMARAL - CL 235;AU NORTE;RIO BOGOTÁ  Y  M. COTA;Urbano;Casablanca Suba II- Guaymaral;Sin Informacion de Veredas;11001
1090;534;53447;MPIO. PUERTO NARE;M. PTO. BOYACA Y SONSÓN;MPIO. PTO. BOYACA;QUEBRADA DORADAL;Rural;Sin Informacion de Barrios;Doradal- El Marañal-  El Pescado-  La Esmeralda-  Parcelas-  Puerto Niño-  Puerto Pita-  Puerto triunfo (Cabecera Municipal)-  San Miguel-  Santiago Berrio-  Sonsón_Antioquia;5591
1091;6805;680527;MPIO. CALIFORNIA Y CUCUTILLA;MPIO. CHARTA- TONA Y SILOS;MUNICPIO MUTISCUA;MPIO. CALIFORNIA Y SURATÁ;Rural;Sin Informacion de Barrios;Angosturas- El Centro-  La Baja-  Pantanos-  Santa ?rsula;68867
1092;534;53410;CL 59;LIMITE URBANO;KR 39;KR 62;Urbano;Sin Informacion de Barrios;Cabecera Municipal- Condor-  La Represa;5893
1093;2720;272057;MUNICIPIO QUIBDÓ;Q. CHIGUARANDO- RÍO PATO Y (PERMANENTE);MPIO. ATRATO Y QUIBDÓ;MUNICIPIO ALTO BAUDÓ;Rural;Sin Informacion de Barrios;Sin Informacion de Veredas;27600
1094;7600;760031;RIO MELENDEZ;RIO PANCE;CL  25;RIO PANCE Y AC L A RIVEIRA;Urbano;Club Farallones- Parcelaciones Pance- Urbanización Ciudad Jardín;Sin Informacion de Veredas;76001
1095;840;84001;LIMITE URBANO;LIMITE URBANO;LIMITE URBANO;LIMITE URBANO;Urbano;Abajo- Centro- El Tabón- Jorge Eliécer Gaitán- La Candelaria- La Concepción- La Pachita- La Plaza- Los Robles- Los Tejados- San Francisco- San Jorge;Sin Informacion de Veredas;8560
1096;6835;683507;MUNICIPIO BARICHARA;MPIO. SOCORRO Y PINCHOTE;MPIO. BARICHARA Y SAN GIL;MPIO. GALÁN Y PALMAR;Rural;Sin Informacion de Barrios;Baraya- El Altico-  El Colorado-  El Hoyo-  El Oval-  La Llanada-  Luchadero-  Naranjal-  San Pedro-  Santuario-  Sardinas;68121
1097;1524;152469;RÍO PESCA;MUNICIPIO ZETAQUIRA;MUNICIPIO TOTA;MUNICIPIO RONDON;Rural;Sin Informacion de Barrios;Butaga- Carbonera-  Chaguata-  Chaviga-  Gacal-  Hato-  Puerta Chiquita;15542
1098;7305;730580;LIMITE URBANO;LIMITE URBANO;A LA CRISTALINA;LIMITE URBANO;Urbano;Sin Informacion de Barrios;Sin Informacion de Veredas;73861
1099;8610;861047;MPIO. EL TABLÓN DE GO. Y BUESACO;MUNICIPIO SANTIAGO;MUNICIPIO SIBUNDOY;MUNICIPIO BUESACO;Rural;Sin Informacion de Barrios;Juandy Alto;86219
1100;7010;701030;CL 33A;CL 10;LIMITE URBANO;LIMITE URBANO;Urbano;Sin Informacion de Barrios;Sin Informacion de Veredas;70508
1101;1508;150820;CL 10;CL 1;KR 1;KR 9;Urbano;Sin Informacion de Barrios;Sin Informacion de Veredas;15720
1102;534;53428;RÍO SWAN;M. PTO. NARE Y BOLIVAR;MUNICIPIO CIMITARRA;MPIO. MACEO Y CARACOLI;Rural;Sin Informacion de Barrios;Cabañas- Cabecera Municipal-  Caño Baúl-  El Jardín-  Ermitaño-  Grecia-  La Calera-  La Carlota-  Las Flores-  Malena-  Murillo-  Puerto Olaya-  Tierradentro;5579
1103;7600;760006;KR  1;KR  7;M. PALMIRA;AC ORIENTAL;Urbano;Fonaviemcali- Jorge Eliecer Gaitán- La Rivera I- Los Alcázares- Petecuy I- Petecuy II- Petecuy III- San Luis- San Luis II- Urbanización Calimio;Sin Informacion de Veredas;76001
1104;514;51460;CL 16;CL 6;LIMITE URBANO;LIMITE URBANO;Urbano;Sin Informacion de Barrios;Sin Informacion de Veredas;5411
1105;1330;133007;M. SAN SEBASTIAN DE BUENAVISTA;MUNICIPIO MARGARITA;MUNICIPIO GUAMAL;VIA GUATACA-SANTA ROSA;Rural;Sin Informacion de Barrios;Sin Informacion de Veredas;13650
1106;7610;761048;MPIO. RIOFRÍO Y TULUÁ;VÍA BUGA-PUENTETIERRA;M. GUA. DE BUGA Y SAN PEDRO;MUNICIPIO CALIMA;Rural;Sin Informacion de Barrios;El Remolino- Jiguales-  La Cecilia-  La Florida-  La Gaviota-  La Primavera-  La Rivera-  Paramillo;76890
1107;1340;134068;RÍO CAUCA;MUNICIPIO NECHÍ;MUNICIPIO MONTECRISTO;M. NECHÍ Y AYAPEL;Rural;Sin Informacion de Barrios;El Jobo- Las Delicias-  Las Peñas-  Los Novillos-  Madre Vieja-  Media Luna-  Meque-  Papayal-  Regencia-  San Agustín-  San Camilo-  Tambo-  Villa Uribe;13655
1108;5235;523527;M. IMUES- YACUANQUER Y TANGUA;MUNICIPIO PUERRES;RELIEVE M. Y RÍO TELLÉZ;MPIO. ILES Y CONTADERO;Rural;Sin Informacion de Barrios;Los Arrayanes- San Miguel;52287
1109;6840;684058;M. ZAPATOCA Y SAN V. DE CHUC.;RÍO (PERMANENTE);MPIO. ZAPATOCA Y BARICHARA;M. SAN V. DE CHU. Y EL CAR. DE CHU.;Rural;Sin Informacion de Barrios;AGUA BLANCA- ARRUGAS-  CASCAJALES-  La Bodega-  La Fuente-  La Guayana-  La Loma-  Piedra Blanca-  San Javier-  YARUMA;68296
1110;5030;503061;LIMITE URBANO;LIMITE URBANO;LIMITE URBANO;LIMITE URBANO;Urbano;Sin Informacion de Barrios;Sin Informacion de Veredas;50590
1111;5455;545537;MUNICIPIO TIBÚ;MPIO. LOURDES Y GRAMALOTE;MUNICIPIO EL ZULIA;RÍO SARDINATA;Rural;Sin Informacion de Barrios;Sin Informacion de Veredas;54720
1112;810;81027;MUNICIPIO PUERTO COLOMBIA;MUNICIPIO BARANOA;MUNICIPIO GALAPA;VIA TUBARA - BARRANQUILLA;Rural;Sin Informacion de Barrios;Sin Informacion de Veredas;8832
1113;1524;152427;M. MONGUA Y SOGAMOSO;MUNICIPIO PAJARITO;M.LABRANZAGRANDE;VÍA AQUITANIA - CHAMEZA;Rural;Sin Informacion de Barrios;Sin Informacion de Veredas;15047
1114;500;50016;CL  49;CL  27 Y 26;KR 30- 32-CL 31A Y KR 31;KR  46 Y 43A;Urbano;Asomadera No.1- Barrio Colón- Bomboná No.1- Buenos Aires- El Salvador- Gerona- Las Palmas- San Diego;Sin Informacion de Veredas;5001
1115;2526;252627;MPIO. TENA Y BOJACÁ;MUNICIPIO GRANADA;MPIO. BOJACÁ Y SOACHA;MUNICIPIO EL COLEGIO;Rural;Sin Informacion de Barrios;ANTIOQUIA- ARRACACHAL-  BOSATAMA-  CAICEDO-  CANOAS-  CHICAQUE-  COLOMBIA-  CUSIO-  EL CAJON-  EL CAJON-  FUTE-  LA ANGUSTIAS-  LA MARTA-  LA RAMBLA-  LA RAPIDA-  LAS PALMAS-  MARSELLA-  POCHOS-  QUEBRADA GRANDE-  SABANETA-  SAN FRANCISCO-  SAN ISIDRO-  S;25645
1116;5245;524540;LIMITE URBANO;LIMITE URBANO;LIMITE URBANO;LIMITE URBANO;Urbano;Sin Informacion de Barrios;Sin Informacion de Veredas;52022
1117;570;57010;CL 12;LIMITE URBANO;KR 6;LIMITE URBANO;Urbano;Sin Informacion de Barrios;Sin Informacion de Veredas;5543
1118;1548;154808;VÌA PAUNA - MARIPI;M. CALDAS Y MARIPI;MUNICIPIO BRICEÑO;MUNICIPIO MARIPI;Rural;Sin Informacion de Barrios;Esperanza- LLano Grande-  Minipi-  Paramo;15531
1119;2300;230002;LIMITE URBANO;CL 29;LIMITE URBANO;RIO SINÚ;Urbano;20 de Julio- 25 de Agosto- 7 de Mayo- Alamedas del Sinú- Altos de La Floresta- Altos del Country- Bosques de Sevilla- Camilo Torres- Cantabria- El Ceibal- El Centro- El Cármen- El Edén I- El Edén II- El Recreo- La Castellana- La Ceiba- La Española- La Flo;El Tapao- Los Piojos;23001
1120;8550;855010;LIMITE URBANO;LIMITE URBANO;LIMITE URBANO;LIMITE URBANO;Urbano;Sin Informacion de Barrios;Sin Informacion de Veredas;85162
1121;5280;528037;MUNICIPIO MOSQUERA;Q. PAPI- CHANUL Y RÍO (PERMA.);MPIO. OLAYA HERRERA;MPIO. FRANCISCO PIZARRO;Rural;Sin Informacion de Barrios;Sin Informacion de Veredas;52621
1122;1935;193570;LIMITE URBANO;LIMITE URBANO;LIMITE URBANO;LIMITE URBANO;Urbano;Sin Informacion de Barrios;Sin Informacion de Veredas;19256
1123;5470;547058;RÍO SAYÁN BOKY Y MPIO. EL CARMEN;QUEBRADA TRINIDAD;MUNICIPIO TEORAMA;MUNICIPIO EL CARMEN;Rural;Sin Informacion de Barrios;Comunidades Indigenas- Costa RIca-  Nueva Colombia;54206
1124;534;53440;LIMITE URBANO;LIMITE URBANO;LIMITE URBANO;LIMITE URBANO;Urbano;Sin Informacion de Barrios;Sin Informacion de Veredas;5591
1125;1101;110111;AC 127;AC 100;LIMITE URBANO;AU NORTE;Urbano;Escuela de Caballería I- Escuela de Caballería II- Escuela de Infantería- Molinos Norte- Páramo- Páramo Urbano II- Páramo Urbano IV- Rincón del Chicó- San Patricio- Santa Ana- Santa Ana Occidental- Santa Bibiana- Santa Bárbara Central- Santa Bárbara Occid;Sin Informacion de Veredas;11001
1126;6865;686569;MPIO. SAN V. DE CHUCURÍ;MUNICIPIO SIMACOTA;RÍO FUEGO Y RÍO SUCIO;MUNICIPIO SIMACOTA;Rural;Sin Informacion de Barrios;Atarrayas- Bellavista-  Caño Indio-  Cayo Doradas-  Cayo Lajas-  Danto Alto-  Diviso de Los Andes-  El Trébol-  La Colorada-  La Cristalina-  La Florida-  La Plazuela-  La Reserva-  La Ye-  Los Olivos-  Monterrey-  NARANJITO-  Rancho Chile-  San Isidro-;68235
1127;5280;528009;M. EL CHAR.- LA TOLA Y OLAYA H.;RÍO PATÍA;Q/DA. STA. CATALINA Y BRAZO BRAVO;MUNICIPIO ROBERTO PAYÁN;Rural;Sin Informacion de Barrios;Sin Informacion de Veredas;52427
1128;5230;523080;LIMITE URBANO;LIMITE URBANO;LIMITE URBANO;LIMITE URBANO;Urbano;Sin Informacion de Barrios;Cabecera Municipal- La Paz-  Providencia-  San Francisco-  Santa Isabel-  Yaez;52210
1129;4120;412080;CL 11;CL 1 S;LIMITE URBANO;KR 16;Urbano;Sin Informacion de Barrios;EL VISO- FLANDES-  YAGUARA;41885
1130;1810;181058;Q/DA. LA MINA Y LA NIÑA MARIA;MPIO. MILAN Y Q/DA. LA CULEBRA;VÍA MATEGUADUA-PALMA AZUL;MUNICIPIO MILÁN;Rural;Sin Informacion de Barrios;Sin Informacion de Veredas;18410
1131;500;50024;CL  29 Y 30;CL  2- 4  Y  6 S;RIO MEDELLIN;KR  70;Urbano;Campo Amor- Cristo Rey- Parque Juan Pablo II- Santa Fé- Tenche- Trinidad;Sin Informacion de Veredas;5001
1132;5205;520570;LIMITE URBANO;LIMITE URBANO;LIMITE URBANO;LIMITE URBANO;Urbano;Sin Informacion de Barrios;Berruecos- Cabecera Municipal-  Chiriurco;52051
1133;4720;472047;MUNICIPIO FUNDACIÓN;M. SABANAS DE SAN ANGEL Y EL COPEY;M. FUNDACIÓN Y EL COPEY;M. PIVIJAY Y SABA. DE SAN ANGEL;Rural;Sin Informacion de Barrios;Algaborro- Bella Vista-  Cabecera Municipal-  Estación Lleras-  Estación Villa-  Loma del Bálsamo-  Monterubio;47030
1134;6845;684541;LIMITE URBANO;LIMITE URBANO;LIMITE URBANO;LIMITE URBANO;Urbano;Sin Informacion de Barrios;Cabecera Municipal- Centro;68271
1135;524;52447;MUNICIPIO CAUCASIA;MUNICIPIO ANORI;RÍO NECHI;MUNICIPIO CACERES;Rural;Sin Informacion de Barrios;Aguas Prieta- Caño la Ocho-  Chilona Abajo-  Chilona Medio-  Cimarrón-  El Pato-  Escarralao-  La Maturana-  La Tabla-  Maestro Esteban Cabecera-  Maestro Esteban Occidental-  Puerto Jobo-  Quebrada Pato-  Rio Viejo-  San Juan de Peluza;5895
1136;550;55077;M. AMAGA Y CALDAS;RELIEVE MONTAÑOSO;MPIO. STA. BARBARA;M. VENECIA Y L. U.;Rural;Sin Informacion de Barrios;El Carretero- La Toscana-  Palomos;5282
1137;7610;761030;CL 10;LIMITE URBANO;LIMITE URBANO;KR 17;Urbano;Sin Informacion de Barrios;Sin Informacion de Veredas;76616
1138;574;57467;MUNICIPIO FRONTINO;M. URRAO Y CAICEDO;M. CAÑASGORDAS-GIRALDO Y SFE ANTIOQUIA;MUNICIPIO FRONTINO;Rural;Sin Informacion de Barrios;Anocozca- Apucarco-  Cabecera Municipal-  Corcobado-  Cuajaron-  El Canelito-  El Cejen-  El Cerro-  El Churimbo-  Insor-  La Antigua-  La Balsa-  La Nancui-  La Timotea-  La Unión-  Las Azules-  Las Juntas-  Milagrosa Alta-  Monos-  Morotó-  Musinguita-;5004
1139;1536;153608;MUNICIPIO BOYACÁ;MUNICIPIO TIBANÁ;M. RAMIRIQUI Y VÍA TIBANÁ-JENESANO;MPIO. NUEVO COLÓN;Rural;Sin Informacion de Barrios;Carional- Foraquira-  Pirambuata-  Rodriguez;15367
1140;2700;270070;LIMITE URBANO;LIMITE URBANO;LIMITE URBANO;LIMITE URBANO;Urbano;Sin Informacion de Barrios;Sin Informacion de Veredas;27425
1141;4120;412087;MPIO. TERUEL Y PALERMO;MPIO. TESALIA Y GIGANTE;MPIO. HOBO Y CAMPOALEGRE;MPIO. IQUIRA Y TERUEL;Rural;Sin Informacion de Barrios;BAJO MIRADOR- BETANIA-  JAGUAL-  LA PAZ-  LAS VUELTAS-  LETRAN-  Llano Sur-  NAZARETH-  VILACO;41885
1142;5400;540019;VIA EL PLOMO - LAS VACAS;MUNICIPIO SAN CAYETANO;QUEBRADA LA FLORESTA;MUNICIPIO EL ZULIA;Rural;Sin Informacion de Barrios;La Florida- Urimaco;54001
1143;2310;231029;CAÑO EL GUAMO;VÍA SABANAL-COTOCA ARRIBA;MPIO. CHIMA Y CAÑO EL ESPINO;RÍO SINÚ;Rural;Sin Informacion de Barrios;Sin Informacion de Veredas;23417
1144;7315;731587;MUNICIPIO FRESNO;MUNICIPIO FALÁN;MUNICIPIO FALÁN;MUNICIPIO CASABIANCA;Rural;Sin Informacion de Barrios;Abejas- Alto Bonito-  Alto Guali-  Asturias-  Bajo Guali-  Cabecera Municipal-  El Olimpo-  El Palmar-  La Primavera-  Las Delicias-  Los Arrayanes-  Muleros-  Playarica;73520
1145;2526;252640;CL 19;KR 0;LIMITE URBANO;LIMITE URBANO;Urbano;Sin Informacion de Barrios;Apicatá- Cabecera Municipal-  La Chica-  Las Mercedes-  San Antonio-  San José-  San Judas-  Santa Bárbara-  Santa Rosa;25035
1146;5470;547037;QUEBRADA TRINIDAD;MUNICIPIO OCAÑA;M. SAN CALIXTO Y EL TARRA;MUNICIPIO CONVENCIÓN;Rural;Sin Informacion de Barrios;Aires del Catatumbo- Bejuco-  Caño Seco-  Cuatro Esquinal Baja-  Cuatro Esquinas Alta-  El Caiman-  El Diamante-  El Diviso-  El Socorro-  El Tagual-  Escalas-  Gurapales-  Juridicciones-  La Ceiba-  La Muralla-  La Teja-  Llana Alta-  Llana Baja-  Los Ra;54800
1147;4760;476027;MUNICIPIO EL PIÑÓN;MPIO. PEDRAZA Y CONCORDIA;MUNICIPIO ZAPAYÁN;M. CALAMAR- SUÁN Y CAMPO DE LA CRUZ;Rural;Sin Informacion de Barrios;Sin Informacion de Veredas;47161
1148;2536;253647;MUNICIPIO LA PALMA;VIA FURATENA-LA PEÑA-EL VALLE;MUNICIPIO EL PEÑÓN;MPIO. LA PALMA Y UTICA;Rural;Sin Informacion de Barrios;AGUA BLANCA- LA FLORESTA-  MESA DE AGUABLANCA-  NACUMA;25398
1149;8620;862047;MPIO. VALLE DEL GUAMUEZ;PAÍS ECUADOR;MPIO. VALLE DEL GUAMUEZ;MPIO. VALLE DEL GUAMUEZ;Rural;Sin Informacion de Barrios;Sin Informacion de Veredas;86757
1150;574;57438;M. BELEN DE BAJIRA Y MUTATÁ;MUNICIPIO FRONTINO;VIA MUTATÁ - DABEIBA;M. MURINDÓ Y CARMEN DEL DARIEN;Rural;Sin Informacion de Barrios;Alto Bonito- Barrancas-  Boton-  Cañaverales Antado-  Carra-  Chever-  Chichirido-  Chimurro-  Chimurro-  Chimurro Nendo-  Choromado-  Choromando Alto-  Chuscal de Murri-  Chuscal tuguridocito-  Cienaga-  Coredo-  Cuevas-  Dabeiba Viejo-  El Hobo-  El Moh;5234
1151;6855;685541;LIMITE URBANO;LIMITE URBANO;LIMITE URBANO;LIMITE URBANO;Urbano;Sin Informacion de Barrios;Cabecera Municipal- Centro;68327
1152;2010;201040;LIMITE URBANO;LIMITE URBANO;LIMITE URBANO;LIMITE URBANO;Urbano;Sin Informacion de Barrios;Sin Informacion de Veredas;20032
1153;6860;686007;M. YONDO Y B/BERMEJA.;MUNICIPIO CIMITARRA;M. SIMACOTA Y Q/DA. LA EME;MUNICIPIO CIMITARRA;Rural;Sin Informacion de Barrios;Caño Viejo- Carare-  Cienaga del Opon-  La Ganadera-  Los Morros;68573
1154;4410;441008;ARROYO WALASHI-  LIMÓN Y CHAGUAINA.;MUNICIPIO MAICAO;MUNICIPIO URIBIA;ARRO. JAPUOHU- AMAMANA Y  SHISHOMANA;Rural;Sin Informacion de Barrios;Sin Informacion de Veredas;44560
1155;2508;250810;LIMITE URBANO;LIMITE URBANO;LIMITE URBANO;LIMITE URBANO;Urbano;Sin Informacion de Barrios;Sin Informacion de Veredas;25873
1156;2720;272027;MPIO. RÍO QUITO- ATRATO Y LLORO;MUNICIPIO TADÓ;MUNICIPIO BAGADÓ;M. UNIÓN PA. Y EL CANTÓN DEL SAN P.;Rural;Sin Informacion de Barrios;La Toma- Parecito-  Paredes;27160
1157;6320;632027;MUNICIPIO CALARCÁ;MUNICIPIO PIJAO;MUNICIPIO CAJAMARCA;MUNICIPIO BUENAVISTA;Rural;Sin Informacion de Barrios;Altamira- Bellavista-  Cabecera Municipal-  Carniceros-  Carniceros-  Guayabal-  Guayaquil Bajo-  Jardín Alto-  Jardín Bajo-  La Concha-  La Española-  La Mina-  La Playa-  Media Cara-  Palmera-  Río Verde Alto-  Siberia Alta-  Siberia Baja;63212
1158;6300;630001;CL  36;LIMITE URBANO;LIMITE URBANO;LIMITE URBANO;Urbano;14 de Octubre- 19 de Enero- 8 de Marzo- Alcazar del Café- Antonio Nariño- Arenales- Arrayanes- Bambusa- Bosques de Gibraltar- Bosques de Pinares- Boyacá- Brasilia- Brasilia Nueva- Cañas Gordas- Calima- Castilla Grande- Ciudadela Simón Bolívar- Conjunto Ba;Sin Informacion de Veredas;63001
1159;6815;681518;MUNICIPIO CERRITO;MPIO. ENCISO Y CARCASÍ;VIA CERRITO-MPIO. CARCASÍ;VIA MALAGA - CERRITO;Rural;Sin Informacion de Barrios;Bavega- Cuchaga-  Robles-  Santa Helena;68207
1160;4100;410001;LIMITE URBANO;AC  26;KR  7;M. PALERMO;Urbano;Acrópolis- Alvaro Leyva Lievano- Balcones De La Riviera III Etapa- Calamari- California- Camilo Torres- Capri- Carlos Pizarro León Gómez- Chicalá- Ciudadela Comfamiliar- Colmenar- Colmenar III Etapa- Combeima- Conarvar- Conjunto Multi Familiar El Portal D;Sin Informacion de Veredas;41001
1161;9150;915017;MUNICIPIO SOLANO;MUNICIPIO LA CHORRERA;RÍO PERMANENTE;MUNICIPIO LA CHORRERA;Rural;Sin Informacion de Barrios;Sin Informacion de Veredas;91669
1162;7320;732020;LIMITE URBANO;LIMITE URBANO;CL 18;CL 1 N;Urbano;Sin Informacion de Barrios;Sin Informacion de Veredas;73443
1163;7335;733587;VÍA SUÁREZ-CUNDAY;MUNICIPIO PURIFICACIÓN;MUNICIPIO CUNDAY;MPIO. PURIFICACIÓN Y GUAMO;Rural;Sin Informacion de Barrios;Agua Blanca- Cairo Leticia-  Cairo Santa Helena-  Cairo Socorro-  Campo Alegre-  El Consuelo-  El Salero-  Hato Viejo-  La Chamba-  La Honda-  La Isla-  Las Mesas-  Oriente Chipuelo-  Rincón Santo La Troja-  San Antonio-  San Cayetano-  San Francisco-  Sa;73770
1164;5450;545070;LIMITE URBANO;CL 2;LIMITE URBANO;KR 7;Urbano;Antonio Silva- Centro- Dardanelos- Divino Niño- El Rosio- José Rosario Duarte- La Loma- La Palma;Sin Informacion de Veredas;54418
1165;6840;684061;CL 28;CL 3;KR 2;KR 14;Urbano;Jesús Nazareno- La Loma- La Ruíz- Las Flores- Las Mercedes- Lenguerke- San Bernardo- San Vicentico- Santa Bárbara;Carrizal- Las Flores-  Santa Rosa;68895
1166;2532;253230;CL 6BIS;CL 1 S;KR 1;KR 10;Urbano;Sin Informacion de Barrios;Sin Informacion de Veredas;25867
1167;4770;477009;MAR CARIBE;MUNICIPIO REMOLINO;MUNICIPIO PUEBLOVIEJO;CAÑO SAN JUAN- EL MORRO Y RÍO (PÉRMA.);Rural;Sin Informacion de Barrios;Sin Informacion de Veredas;47745
1168;4760;476037;MPIO. CERRO SAN ANTONIO;M. PEDRAZA Y CERRO SAN ANTONIO;MPIO PEDRAZA Y ZAPAYÁN;M. CERRO SAN ANTONIO;Rural;Sin Informacion de Barrios;Sin Informacion de Veredas;47205
1169;6815;681527;MUNICIPIO CONCEPCIÓN;MUNICIPIO SAN MIGUEL;VIA CERRITO-RÍO (PERMANENTE);M. CONCEPCIÓN Y ENCISO;Rural;Sin Informacion de Barrios;Sin Informacion de Veredas;68152
1170;1538;153860;LIMITE URBANO;LIMITE URBANO;KR 1;KR 10;Urbano;Sin Informacion de Barrios;Sin Informacion de Veredas;15776
1171;1116;111631;AC  3;AU SUR;AK  30;AK  50;Urbano;Autopista Muzú- Autopista Muzú Oriental- Bochica- Jorge Gaitán Cortés- La Asunción- Montes- Remanso- Remanso Sur- Santa Matilde;Sin Informacion de Veredas;11001
1172;2300;230009;MUNICIPIO CERETÉ;VÍA MONTERIA-EL CERRITO;MUNICIPIO SAN CARLOS;VÍA MONTE.-EL DOCE Y LIM. URB.;Rural;Los Cedros- Urbanización Altos del Norte- Urbanización Comfacor- Urbanización Villa Cielo;El Claval- El Faro-  Los Pericos;23001
1173;520;52030;LIMITE URBANO;CL 12;KR 12;LIMITE URBANO;Urbano;Sin Informacion de Barrios;Mina Vieja- Vereda Cabecera municipal;5887
1174;1310;131029;MUNICIPIO TURBANA;MPIO. MA. LA BAJA Y SAN ONOFRE;VIA ARJONA - CORREA;MUNICIPIO SAN ONOFRE;Rural;Sin Informacion de Barrios;Sin Informacion de Veredas;13052
1175;6835;683568;MPIO. EL CARMEN DE CHUCURI;M. STA. HELENA DEL O. Y VELEZ;QUEBRADA ARAGUA;RÍO (PERMANENTE);Rural;Sin Informacion de Barrios;El Indio- El Indio Bajo-  El Reposo-  El Sinaí-  Flores Blancas-  La Belleza-  La Victoria-  Las Flores-  Los Alpes-  Santo Domingo-  Trochas Al Medio II;68745
